	hrefs	posts	replies	threads	views
0	http://www.englishforum.ch/commercial-events/168852-faq-how-create-recurring-event.html	                                            	0	FAQ : How to Create a Recurring Event	5,581
1	http://www.englishforum.ch/commercial-events/8100-posting-commercial-event-read-first.html	" 
			
			Thanks for the info. I was going nuts trying to post something and still didn't know if it was commercial or social. its actually both tho!
		 
			
			Hello, freelancing,    
if there is a cover that people will be charged at your event, please, be aware that makes it a commercial event. You can post 10 posts of some relevance and value to our expat community and life in CH, then make your commercial event.    
Thanks, MC.
		 
			
			Hello everyone.    
can anyone please help me with this question ?    
I just planned two events, and did not find anywhere a setting of how many members would be allowed to RSVP. I did mention that in the event description, but is not there usually a parameter to set with that information ?    
will I have to keep monitoring my event and stop RSVP manually ??   
and if so, how do you stop people from replying RSVP ?  I mean how do you tell people that an event is full and no one would be allowed to still RSVP ?
		 
			
			As far as I know, Marc73, you can limit the number of guests someone may bring - the default is 20! - but once your quota is full, there's no way of stopping people signing up. Unless you set a date when the sign-ups for the event are closed, but I'm not sure if even that's possible; I've only seen it once the event's date has passed. You can, however, bump people off the list; as organiser you will see a [remove] option next to each person's name. It's up to you to exercise this feature or not.   
It's best relying on people's good will and asking them not to sign up anymore. If you find it's only a few, fair enough - some will anyway not turn up        
thank you very much. I really appreciate your kind answer.
		    Actually I think there is a way, 'cos I managed it once. I think once your event is full you can change the   to the number of days and hours you are at ""now""  before the event... if you get my drift (do this by editing the event).    
The event should then be ""closed"" for RSVP's   
You should also edit the event description and add in bold at the bottom "" ""... or words to that effect. I don't quite have the eloquence that Uncle max has in telling people that they've left it too late       Beware of editing the event as there have been occassions in the past where all the RSVPs are deleted   I don't know if this was a bug or a problem between the monitor and chair. It may be an idea to note who's in before editing anything...
		 
			
			When editing an event you do not loose the rsvps, but you will sometime s loose the +1 guests on the event. Just be carefull what options you chose when editing. If you try to change the end of rsvp date after youve posted you will loose all your rsvps.  
The best way to stop the event , is to make sure you put a close time and date at least 24 hours before the actual event, when first posting . It will automatically close off the event.  
Otherwise you will have to rely on good will, and edit the event to show , it is fully booked.    
			
			Here are the guidelines for posting commercial events.        
You probably know already that your event is commercial, rather than social. In short, if you're advertising your business, charging a fee or hoping to sell something, then it's a commercial event.   have no commercial interest.    
Examples of commercial events are comedy nights, wine tasting, salsa class and advertising concerts. This also includes clubs that charge for events or membership fees.    
Commercial events should specify if there is an entry fee or other price attached. They should preferably have some angle of interest for the expat/englishforum community.   
Example: If I invite people to meet in a pub to watch Chris Black sing, then it's a social event. If Chris himself makes the invitation, then it's commercial.        
There are now two calendars: social (default calendar) and commercial. This helps to separate the different types of event. To see the commercial calendar, look at the bottom right of the calendar and use the “Calendar Jump” field.    
Commercial events should only be posted in the commercial calendar.        
In order to post an event, you have to have a little forum history. Most people qualify pretty quickly. The reason for this is that we want to encourage people to be an active part of the community and not to use it just for free advertising. The qualifications are as follows:   
In case you have further questions, feel free to post your question here.
		"	8	Posting a commercial event? Read this first ...	14,469
2	http://www.englishforum.ch/commercial-events/264616-mindfulness-based-stress-reduction-zurich.html		0	(Zurich, Other, Alfred Escher-Strasse 36) Mindfulness Based Stress Reduction Zurich | 11.01.2017 19:30 - 08.03.2017 22:00	157
3	http://www.englishforum.ch/commercial-events/264615-basel-other-lothringerstrasse-108-mindfulness-based-stress-reduction-basel-16-01-2017-19-00-13-03-2017-09-30-a.html		0	(Basel, Other, Lothringerstrasse 108) Mindfulness Based Stress Reduction Basel | 16.01.2017 19:00 - 13.03.2017 09:30	115
4	http://www.englishforum.ch/commercial-events/262567-z-rich-other-viewfinder-center-350-digital-photography-beginners-course-12-01-2017-a.html	" 
			
			Hi, do you also have courses for not so much beginners?
		 
			
			Hello 
Interested to explore how the photography hobby be converted into a profession? any tips/suggestions?
		"	2	(Zürich, Other, Viewfinder Center, 350) Digital Photography Beginners Course | 12.01.2017	609
5	http://www.englishforum.ch/commercial-events/264142-geneva-concert-show-thtre-du-leman-quai-de-mont-blanc-19-ge-chf-75-65-55-dara-o-brian-live-geneva-22-01-2017-20-00-22-30-a.html		0	(GENEVA, Concert/Show, Thtre du Leman, Quai de Mont Blanc 19 GE, Chf 75/65/55.-) Dara O Brian Live in Geneva | 22.01.2017 20:00 -  22:30	252
6	http://www.englishforum.ch/commercial-events/264141-basel-concert-show-rhypark-m-lhauserstrasse-17-4056-basel-chf-65-dara-o-brian-live-basel-21-01-2017-20-00-22-30-a.html		0	(BASEL, Concert/Show, Rhypark, Mülhauserstrasse 17, 4056 Basel, Chf 65.-) Dara O Brian Live in Basel | 21.01.2017 20:00 -  22:30	165
7	http://www.englishforum.ch/commercial-events/264140-zurich-concert-show-volkshaus-stauffacherstr-60-8003-zh-chf-65-dara-o-brian-live-zurich-20-01-2017-20-00-22-30-a.html		0	(ZURICH, Concert/Show, Volkshaus, Stauffacherstr. 60, 8003 ZH, Chf 65.-) Dara O Brian Live in Zurich | 20.01.2017 20:00 -  22:30	195
8	http://www.englishforum.ch/commercial-events/264139-basel-concert-show-alte-markthalle-4051-basel-chf-40-35-international-comedy-club-basel-simon-evans-14-01-2017-20-00-22-00-a.html		0	(BASEL, Concert/Show, Alte Markthalle, 4051 Basel, Chf 40/35.-) International Comedy Club Basel - Simon Evans | 14.01.2017 20:00 -  22:00	199
9	http://www.englishforum.ch/commercial-events/264138-zurich-concert-show-mscotte-theaterstr-10-8001-zurich-chf-40-35-international-comedy-club-zurich-simon-evans-13-01-2017-20-00-22-00-a.html		0	(ZURICH, Concert/Show, Mscotte, Theaterstr. 10, 8001 Zurich, Chf 40/35.-) International Comedy Club Zurich - Simon Evans | 13.01.2017 20:00 -  22:00	246
10	http://www.englishforum.ch/commercial-events/264136-geneva-concert-show-uptown-geneva-2-rue-de-servette-1201-g-e-chf-40-35-international-comedy-club-geneva-simon-evans-11-01-2017-20-00-22-00-a.html		0	(GENEVA, Concert/Show, Uptown Geneva 2 Rue de Servette 1201 G E, Chf 40/35.-) International Comedy Club Geneva - Simon Evans | 11.01.2017 20:00 -  22:00	217
11	http://www.englishforum.ch/commercial-events/264003-landesmuseum-other-museumstrasse-2-zurich-free-entrance-live-ice-19-12-2016-16-00-02-01-2017-22-00-a.html	" 
			
			Was there in the weekend - Just a thumbs up, it was very cosy.
		"	1	(Landesmuseum, Other, Museumstrasse 2, Zurich, Free entrance) Live on Ice | 19.12.2016 16:00 - 02.01.2017 22:00	262
12	http://www.englishforum.ch/commercial-events/263820-15-12-2016-rogue-one-premier-luzern.html	" 
			
			official unofficial Rogue One Premier at the verkehrshaus Luzern from 18:00 to 22:15 not sure if its sold out yet but 'stuff' will be happening outside from 18:00 so if you have little starwars fans bring them along        
the reviews of the film so far have been very positive.   
(there is no official disney swiss premier)
		 
			
			ok, a few seats are available still, film starts at 20:00 on the Imax screen in english (french and german subs)
		 
			
			shameless bump
		 
			
			Premier? I saw this yesterday afternoon!   
Enjoy the film, I really liked it    
			
			I had tickets for the premier of the ""Force Awakens"" - when I got to the door I was told by some old guy it wasn't the premier I was looking for.    
I think I'll wait until it is available on VHS.          
for some bizarre reason it came out a day early in the french part? gotta love movie companies
		    Yep, opened in Fribourg yesterday. A mate went to see it, but I'm waiting till I can find a slot where both my kids can go too.
		"	6	15/12/2016 Rogue one premier Luzern	368
13	http://www.englishforum.ch/commercial-events/262920-z-rich-special-promotion-british-cheese-centre-limmatstrasse-231-english-sparkling-wine-degustation-10-12-2016-13-00-17-00-a.html	" 
			
			Sparkling Wine generally combines really well with mild or washed rinded cheeses, so on Saturday afternoon we'll have quite a few cheeses open to try with the wine including:   
Baron Bigod, a soft raw milk cheese from Suffolk, Drunken Burt - Cider washed mild cows milk from Cheshire, Cornish Yarg, Stinking Bishop, Swaledale Goat, Ribblesdale Sheep and our best selling Godminster Bio Cheddar.   
Hope you can make it!
		 
			
			What time is the wine tasting on Saturday, GG?
		    1 - 6!
		"	3	(Zürich, Special Promotion, British Cheese Centre, Limmatstrasse 231) English Sparkling Wine Degustation | 10.12.2016 13:00 -  17:00	627
14	http://www.englishforum.ch/commercial-events/262723-affoltern-am-albis-other-emk-affoltern-z-richstrasse-47-no-traditional-english-carol-service-affoltern-am-albis-11-december-11-12-2016-17-00-20-00-a.html	" 
			
			I'm not religious, but I do miss a good carol service. I'll try to get along.
		 
			
			Will definitely try - I love a Christmas sing-song too. 
Thanks for passing this on ...
		 
			
			Will there be lyric sheets?   
I've been here so long that I can't remember most of the words anymore. The last time I was back in Canada I ended up reciting the Lords prayer in German when I went to church with my mum.
		 
			
			Lovely to see interest, would be great to have you join!   
I am in the process of making the booklets with the words to the carols  and I think there are even plans to have them on a projector, need to check that. If there are several people arriving by train from Zurich, we can arrange to have someone go to the train station to make sure you find it alright.
		 
			
			Wonderful idea! Thanks for organizing it. Already looking forward to it.
		 
			
			So just a few days to go and preparations well underway. Based on a message received I just wanted to clarify that this will not be a ""choir boys and organ music"" type of carol service - simply a small congregation opening its doors to anyone who wishes to join in on the festive spirit. Everyone involved is really looking forward to it and we hope it will be a great success, as it's the first time this particular church community is doing this.   "	6	(Affoltern am Albis, Other, EMK Affoltern, Zürichstrasse 47, No) Traditional English Carol Service in Affoltern am Albis on 11 December | 11.12.2016 17:00 -  20:00	592
15	http://www.englishforum.ch/commercial-events/263548-lausanne-concert-show-cin-ma-obl-avenue-de-france-9-catcave9-monthly-english-science-improv-theater-lausanne-15-12-2016-a.html	" 
			
			This sounds very nice. I will defenately stop by one day   "	1	(Lausanne, Concert/Show, Cinéma Oblò, Avenue de France 9) CatCave9: Monthly English Science Improv Theater in Lausanne | 15.12.2016	297
16	http://www.englishforum.ch/commercial-events/263007-zurich-brunau-other-fork-bottle-allmendstrasse-20-8002-pop-up-restaurant-02-12-2016-17-30-18-12-2016-23-00-a.html	" 
			
			A location would be helpful. And, no, I'm not going to follow your link
		    Why not - what could be more intriguing than hearty French food served in a medieval tavern combined with cocktails.    
			
			Well if it's in Zürich I'll give it a miss.
		    Here you go, hearty French food served in a medieval tavern combined with   cocktails.
		      It is in Zurich: 
POP UP RESTAURANT CURIOUS: 
When: 2.12 -18.12 
Where: Barn opposite Fork and Bottle (Zürich Brunau)
		 
			
			I was there a few days ago for dinner.    
It's really good farm to table style french cuisine. Sort of what you'd get in taverns and bistros in paris.    
Heading back tonight. The food has a lovely homemade taste to it and when it's gone, it's gone. I wouldn't know where else to go in Zurich for this.    
Oh and I had the tiramisu shot for dessert - perfect in taste and size    
The prices are also reasonable. They were less than Zurich prices at the opening night when I went.
		"	6	(Zurich Brunau, Other, Fork and Bottle, Allmendstrasse 20, 8002) Pop up restaurant | 02.12.2016 17:30 - 18.12.2016 23:00	1,046
17	http://www.englishforum.ch/commercial-events/263397-basel-concert-show-scala-basel-basel-panto-dick-whittington-dec-8-11-08-12-2016-19-30-11-12-2016-19-00-a.html	" 
			
			Tickets still available on all days.
		"	1	(Basel, Concert/Show, Scala Basel) Basel Panto - Dick Whittington Dec 8-11 | 08.12.2016 19:30 - 11.12.2016 19:00	374
18	http://www.englishforum.ch/commercial-events/262458-zurich-concert-show-feldstr-144-sch-neggplz-8004-live-classical-music-night-hotel-bar-z-rich-04-12-2016-18-00-23-00-a.html	" 
			
			Thanks to all who attended last night - it was quite beautiful to have such live music in our cosy bar.
		"	1	(Zurich, Concert/Show, Feldstr 144 Schöneggplz 8004) Live Classical Music Night at Hotel Bar Zürich | 04.12.2016 18:00 -  23:00	536
19	http://www.englishforum.ch/commercial-events/263452-zurich-other-global-people-transitions-hedwigsteig-6-900-1100-hireme-group-coaching-program-07-04-2017-10-00-05-05-2017-12-00-a.html	" 
			
			Seems that you are a little ahead of yourself...the webpage doesn't exist yet.   
Nothing found Sorry, we couldn't understand what you meant. Try searching below... 
Search for:
		"	1	(Zurich, Other, Global People Transitions, Hedwigsteig 6, 900 - 1100) HireMe! Group Coaching Program | 07.04.2017 10:00 - 05.05.2017 12:00	276
20	http://www.englishforum.ch/commercial-events/263451-zurich-other-global-people-transitions-hedwigsteig-6-900-1100-hireme-group-coaching-program-03-02-2017-15-00-03-03-2017-17-00-a.html		0	(Zurich, Other, Global People Transitions, Hedwigsteig 6, 900 - 1100) HireMe!  Group Coaching Program | 03.02.2017 15:00 - 03.03.2017 17:00	239
21	http://www.englishforum.ch/commercial-events/263449-zurich-other-global-people-transitions-hedwigsteig-6-900-1100-hireme-group-coaching-program-20-01-2017-10-00-17-02-2017-12-00-a.html		0	(Zurich, Other, Global People Transitions, Hedwigsteig 6, 900 - 1100) HireMe! Group Coaching Program | 20.01.2017 10:00 - 17.02.2017 12:00	281
22	http://www.englishforum.ch/commercial-events/262908-zurich-other-outback-lodge-stadelhofen-aussies-zurich-drinks-02-12-2016-18-30-23-30-a.html	" 
			
			Well I drink alone, no Aussies on EF?
		 
			
			There are, but we are far and wide, not to mention lazy and unmotivated to go out in -6 degrees......( I speak for myself of course)
		"	2	(Zurich, Other, Outback Lodge Stadelhofen) Aussies in Zurich drinks | 02.12.2016 18:30 -  23:30	532
23	http://www.englishforum.ch/commercial-events/263330-basel-concert-show-alte-markthalle-steinentorberg-20-4051-chf-40-35-international-comedy-club-basel-sean-mcloughlin-angela-barnes-10-12-2016-20-00-22-00-a.html		0	(BASEL, Concert/Show, Alte Markthalle, Steinentorberg 20, 4051, Chf 40/35.-) International Comedy Club Basel - Sean McLoughlin + Angela Barnes | 10.12.2016 20:00 -  22:00	282
24	http://www.englishforum.ch/commercial-events/263329-zurich-concert-show-mascotte-theaterstr-10-8001-zurich-chf-40-35-international-comedy-club-zurich-sean-mcloughlin-angela-barnes-09-12-2016-20-00-22-00-a.html		0	(ZURICH, Concert/Show, Mascotte, Theaterstr. 10, 8001 Zurich, Chf 40/35.-) International Comedy Club Zurich - Sean McLoughlin + Angela Barnes | 09.12.2016 20:00 -  22:00	334
25	http://www.englishforum.ch/commercial-events/263328-lausanne-concert-show-no-name-bar-chauderon-18-1003-lu-chf-30-25-international-comedy-club-lausanne-sean-mcloughlin-angela-barnes-08-12-2016-20-00-22-00-a.html		0	(LAUSANNE, Concert/Show, No Name Bar, Chauderon 18, 1003 Lu, Chf 30/25.-) International Comedy Club Lausanne - Sean McLoughlin + Angela Barnes | 08.12.2016 20:00 -  22:00	271
26	http://www.englishforum.ch/commercial-events/263327-geneva-concert-show-uptown-geneva-2-rue-de-servette-1201-ge-chf-40-35-international-comedy-club-geneva-sean-mcloughlin-angela-barnes-07-12-2016-20-00-22-00-a.html		0	(GENEVA, Concert/Show, Uptown Geneva, 2 Rue de Servette 1201 GE, Chf 40/35.-) International Comedy Club Geneva - Sean McLoughlin + Angela Barnes | 07.12.2016 20:00 -  22:00	278
27	http://www.englishforum.ch/commercial-events/263143-international-students-weekly-meetup-basel.html	" 
			
			Every Tuesday, a group of international students gather in Prisma Cafe (Habermatten, Basel) to meet new people, learn about other cultures/beliefs, and eat food!   
If you're an international student or academic, please come and check it out - everyone is welcome.   
For more info, visit    
			
			Hi!   
Do you know if there is something similar around Lausanne?
		 
			
			Yes they have something called iCafe:    
			
			Just to clarify - although this is in the commercial events section, it's completely free/gratis/kostenlos  .  It's just not allowed in the social events section because it's not an EF-only event. 
See you there!
		 
			
			Hi, thanks for your answer but Fribourg seems to be a bit far from Lausanne.
		 
			
			Watch out: tucked away at the bottom of their website, it's written that this is a Christian group.    
There are certainly people out there who are interested in some kind of international bible study, but it's dishonest to prey on people far from home who are just looking for some community to push your agenda, especially when you are not upfront about it.
		    Firstly, it's not a bible study group - if you look at the agenda there are a whole bunch of different activities, eg. games, films, talks, fondue, ice skating etc. 
Secondly, there's no 'pushing' - it's run by Christians and I'm sorry if your experience is that Christians are 'pushy', but that's not the case here. People are free to come if they want, or not.. there's no obligation. 
Thirdly, it's a bit harsh to say 'not upfront about it', since - as you've observed - it's pretty plain on the website.  Plus as i wrote in the original introductory post, one aspect is for people to share each other's cultures and beliefs.   
Anyway, tonight is Aussie night - want to come?       Sorry that was the wrong link!  They don't have exactly the same setup but there is a group in Lausanne that has various lunchtime activities:    
And yes, it's also run by Christians
		    Yes, it's run by Christians. Hardly ""tucked away"". It's in one of the main sections:          Yes, it is. Are you sure these are people like that? Or is this just the ugly prejudice and intolerance rearing its head again?
		"	8	International students weekly meetup Basel	494
28	http://www.englishforum.ch/commercial-events/262921-new-outdoor-sports-meetup.html	" 
			
			Hi everyone!   
I have started a new meetup group called  , and if you have a sense of adventure, I invite you all to join!   
We are snowboarders, splitboarders, skiiers, and hikers. Above all, we like adventures and love a good time. I will be organizing small events throughout the year with winter sports focusing on freeriding lesser known gems as well as the more well known ones. Powder is powder, right? We can still ski the pistes, and you better believe we will wash all that down with a beer or two   Spring/Sommer/Fall is all about trails and ales   
It is a group dedicated to the pursuit of outdoor excitement. I hope to foster a real community half as good as this one.   
@admins, please move this post if it is not in the right section.
		"	0	New outdoor sports meetup	414
29	http://www.englishforum.ch/commercial-events/262385-lego-event-18-20th-nov.html	" 
			
			18th - 20th Nov, down the french part        
for all those kids big and small that like lego
		 
			
			Bigblue,  thanks for the link - could be a nice treat for my big boy.   
Has anyone been before? I clicked on the link but have to say it is a crap site - no specific address, etc. If anyone has some info, could you please share here?  Thanks in advance   
			
			address is  
Route Cantonale 11 1426 Concise   
Its open    
18th 16:00 - 20:00 
19th 09:00 - 20:00 
20th 09:00 - 17:00   
 the facebook link has more info, typical swiss standard of advertising really, no idea how to self promote
		 
			
			bb2- you are an expert on such things - but        
they do fetch silly money, especially when they have been discontinued, that is one huge kit iirc it was by far the biggest lego kit when it came out   
check the ebay prices, someone want $6,000 for one!!
		    I wonder what my 7181,7191, 10134, 10030 and 10129 would be worth then            
a lot less if you've opened them       Used star destroyers are 3,200eur!   
The Y-wing seems be the most over values - 6k on Amazon for an unopened one!
		        worth whatever some muppet will pay for them, seen the price of some of the mini figures???? the ones from the falcon go for more then the whole kit !?!?!?!?!?!
		    I only searched because you posted about the show. At some point I'll have to organize what I have and get an idea of value - I have a sneaking suspicion the Lego cupboard is worth a few CHF more than I thought!
		     
hope you kept the boxes too
		 
			
			Is this a commercial event? If so, will the prices beat the Legoland prices?
		    3chf for kids 
6chf for adults   
no rides though
		    Thanks. I meant to ask if they sold legos at competitive prices at this event, or if it was just a building event and then go home*.   
* Quite a commute then, and I would forgo it if that was the case.
		     
no idea if they will be selling anything
		    Yep        
I'm there on the sat, so I'll update this thread on sat pm if they are selling there also
		    That's a bit of a hike for you isn't it?  
We will probably be there on Sunday but it is just down the road from us.
		     
yep, we're helping out, we are there sunday as well
		 
			
			quick bump   
Its this weekend, we'll be there sat & sun, bonus points if you spot us    
			
			I should be there Saturday afternoon
		 
			
			Lego is being sold here, new and pre-loved, don't know if the prices are competitive though
		 
			
			it even made the news      http://www.24heures.ch/news/standard...story/28419855  "	22	Lego event 18-20th Nov	1,235
30	http://www.englishforum.ch/commercial-events/261989-zurich-exhibition-hotel-bar-sch-neggplatz-feldstr-144-tribeka-launch-hotel-bar-zurich-17-11-2016-18-00-23-30-a.html	" 
			
			Our organisations website is now up with info on who we are and why we are proud of Zurich's liveliest neighbourhood. Tribeka is still in it's infancy so expect more info once the launch on November 17th has happened. Join us!   
If you have any questions do let me know. We're here to promote Kreis 4 and look forward to welcoming you.       (in German for now)
		 
			
			Thank you to all who came down over the course of the evening; we chomped through three legs of Jamon, 340 oysters, cases of Cava, gallons of Stout, 75 litres (!) of comforting Hot Toddies and mooched until after 4am...   
I'm still on a protein rush from all the oysters    
It was a pleasure to meet new faces and old as people made their tour of Kreis 4 and the launch of Tribeka. Props to the Beat Pirates for the tunes and the good nature of the guests.    
We look forward to hosting our classical music night on Sunday 4th December: see the events calendar for details.   
Cheers and thanks again.
		"	2	(Zurich, Exhibition, Hotel Bar, Schöneggplatz, Feldstr. 144) Tribeka Launch at Hotel Bar Zurich | 17.11.2016 18:00 -  23:30	679
31	http://www.englishforum.ch/commercial-events/262679-ragdoll-sunday-mcgee-s-sat-26th-nov-band-english-forum-made.html	" 
			
			Evening all,   
About a year ago, I arrived in Switzerland & placed an advert on English Forum looking for like minded musicians.   
The eventual result of that initial advert is the band RAGDOLL SUNDAY; highly listenable original classic rock / grunge influenced music with soaring vocals; marked as one of the hottest new rock bands coming up in Switzerland, with an album due to be released Summer 2017.   
Saturday 26th Nov at 20:30, we'll play a   show at  .   
It'll be one of the only shows where we'll play all the songs which might make it onto next year's album over a 1.5 hour set. All for   You can hear a taste of our music  , from our demo we recorded in May this year.   
There'll be food, drinks & a rocking night all around, & all are welcome!
		"	0	RAGDOLL SUNDAY @ McGee's Sat 26th Nov (the band English Forum made!)	403
