	hrefs	posts	replies	threads	views
32	http://www.englishforum.ch/commercial-events/262585-basel-concert-show-neue-alte-markthalle-4051-basel-chf-40-35-international-comedy-club-basel-mike-wilmot-can-26-11-2016-20-00-22-00-a.html		0	(Basel, Concert/Show, Neue Alte Markthalle, 4051 Basel, Chf 40/35.-) International Comedy Club Basel - Mike Wilmot (Can) | 26.11.2016 20:00 -  22:00	410
33	http://www.englishforum.ch/commercial-events/262584-zurich-concert-show-mascotte-theaterstr-10-8001-zurich-international-comedy-club-zurich-mike-wilmot-can-25-11-2016-20-00-22-00-a.html		0	(Zurich, Concert/Show, Mascotte, Theaterstr. 10, 8001 Zurich) International Comedy Club Zurich - Mike Wilmot (Can) | 25.11.2016 20:00 -  22:00	405
34	http://www.englishforum.ch/commercial-events/262582-lausanne-concert-show-chauderon-18-no-name-bar-1003-lausanne-chf-30-25-international-comedy-club-lausanne-mike-wilmot-can-24-11-2016-20-00-22-00-a.html		0	(Lausanne, Concert/Show, Chauderon 18/No Name Bar, 1003 Lausanne, Chf 30/25.-) International Comedy Club Lausanne - Mike Wilmot (Can) | 24.11.2016 20:00 -  22:00	362
35	http://www.englishforum.ch/commercial-events/262581-geneva-concert-show-uptown-geneva-r-de-servette-2-1201-ge-chf-40-35-international-comedy-club-geneva-mike-wilmot-can-23-11-2016-20-00-22-00-a.html		0	(Geneva, Concert/Show, Uptown Geneva, R. de Servette 2, 1201 GE, Chf 40/35.-) International Comedy Club Geneva - Mike Wilmot (Can) | 23.11.2016 20:00 -  22:00	382
36	http://www.englishforum.ch/commercial-events/262570-zurich-other-viewfinder-center-city-zurich-night-photography-course-09-12-2016-a.html		0	(Zurich, Other, Viewfinder Center & City) Zurich Night Photography Course | 09.12.2016	435
37	http://www.englishforum.ch/commercial-events/262547-vintage-computer-festival-z-rich.html	" 
			
			Hi All, 
Saturday 19.11.16 1100hrs-1900hrs and 
Sunday 20.11.16 1000hrs - 1700hrs   
Exhibition, presentations, games to play and Saturday night party 2100hrs - 0000hrs   
Place Aktionshalle - Dock 18 - Rote Fabrik - Seestrasse 395, 8038 Zurich   
5CHF entrance fee   
If you have any interest in the original computers and the first games, played Pong, Space Invaders, wrote code on C64's - come and look at what they have and enjoy the nostalgia.
		 
			
			Looks interesting, for those interested a bit more information (in German) can be found at:    "	1	Vintage Computer Festival Zürich	403
38	http://www.englishforum.ch/commercial-events/262094-zurich-concert-show-hotel-bar-sch-neggplatz-feldstr-144-free-entry-no-vacancy-dj-set-hotel-bar-zurich-10-11-2016-21-00-11-11-2016-02-00-a.html	" 
			
			Thanks to all who came last night and boogied until 04:00. We had a real mixture of revellers and the mood was very friendly.     
I'm impressed with the general behaviour of guests: gallons of booze drunk, dancing around tables and rarely a broken glass. Best of all never any hassle - thank you!    
We were curious how an Electro night would go down in our usually demure bar but are delighted it was enjoyed by all.    
There are various upcoming events if you're looking to expand your social circle here in Zurich, including an evening of Soprano / Mezzo Soprano singing, readings, improv, our birthday party, more DJ sets...   
Next Thursday - Nov. 17th - we host the opening celebrations of   Zürich. It would be a pleasure to welcome you. Do introduce yourself, especially if you come on your own. We have loads of English speaking customers coming in and our staff love to be hospitable. Customers always end up chatting to each other, too, which is deeply satisfying.    
Cheers!
		"	1	(Zurich, Concert/Show, Hotel Bar, Schöneggplatz, Feldstr. 144, Free Entry) No Vacancy DJ Set at Hotel Bar Zurich | 10.11.2016 21:00 - 11.11.2016 02:00	555
39	http://www.englishforum.ch/commercial-events/262030-zurich-other-outback-lodge-stadelhofen-aussies-zurich-drinks-11-11-2016-18-30-23-30-a.html	" 
			
			Look for Rob or Manny at the bar or ask Ben (Aussie) who works there, it is tonight.
		"	1	(Zurich, Other, Outback Lodge Stadelhofen) Aussies in Zurich drinks | 11.11.2016 18:30 -  23:30	459
40	http://www.englishforum.ch/commercial-events/262348-like-play-scrabble-english.html	" 
			
			Hi, 
The recently created Swiss English-language Scrabble Association warmly invites you to its first Open House on Thursday evening 17th. November as of 19:00. 
So please come along and join us in what should be a very enjoyable evening as you learn about the joys of playing Scrabble and how this new Association intends to promote the English version of the game here in Switzerland and more specifically at present in the Geneva area. 
A very sociable group so it maybe of interest to those new to the Geneva Area and what some English speaking friends. 
The evening will include a demonstration of the game by two famous Swiss players Kevin Meng and Benoit Delafontaine.      
Hope to see you there, Dave Underhill
		 
			
			Brilliant!  When does it come to Zürich    
			
			Slightly off topic, but if you're a Scrabble fan, you'll probably enjoy Bananagrams too.   
A bit like speed Scrabble.  Without a board.  Or points.     
(Probably availible elsewhere too)
		    Can't some of us just meet in a coffee shop and play?    
			
			Where is it happening?
		    I'm in    
			
			I need to be part of this thing.   I hope to fit it in our choir/knitting/yodelling/bouldering/fencing agenda. Although would prefer chess    
Mod hat on - OP, might be better to create an event in our social calendar.
		    I do, but I still need to play the game with someone.   I even have the game.       Haven't played the English version since years (and am sorely out of practice), but would love to get together for a round or two.  Am drowning in work s?st at the moment, but might be able to organise a place near the University
		 
			
			Won't be able to attend. But if one day your group fancies coming out to play up in t'mountains near Pontarlier - I've got a massive room available and kitchen (10 large tables - for free)- and it would be fun to organise. 55 mins from Lausanne.
		 
			
			Hi, 
I am new to the forum and clearly I forgot to attach the Flyer which includes the location (not Coppet).......   Maison de Quartier Asters-Servette,   47 RueSchaub, 1202 Geneva    as of 19:00 
I appreciate the responses so far and nice to hear that there are members out there who like to play scrabble. 
The objective is to encourage all levels of scrabble play, from very social to competition. 
The location where the Open House is to be held is quite ""cosy"" and has an area where children can sit and play should you want to bring them along.     
Hope the attachment works,  Dave
		 
			
			The title of this post made me chuckle   Imagine playing Scrabble in German    
Personally, I love the game, would be happy to join if something comes up in Zurich.
		 
			
			Maison de Quartier Asters-Servette, 47 RueSchaub, 1202 Geneva  
as of 19:00
		    Actually that would be a great learning opportunity    
Please expand to Basel or Zurich or anywhere in between   Geneva is too far for me    
			
			If we do a day here one day- we could have French- English and german tables - I hve both the French and German versions.
		    I have the German version if anyone wants to try       ..with umlauts?
		    Yep. (and only one ""Y"").           Maison de Quartier Asters-Servette,   47 RueSchaub, 1202 Geneva   as of 19:00      Yes, does make things pretty boring - thought that it would spice-up my life, but no.  Will stick to English...
		    Could be worse. The set at our holiday home used to be in Slovenian.
		"	20	Like to play Scrabble in English ?	785
41	http://www.englishforum.ch/commercial-events/262358-zurich-family-rich-yes-bio-neurofeedback-self-sustainability-17-11-2016-19-00-21-30-a.html	"     
Perfect for a Trump voter    
			
			I would be interested but this is unfortunately much too short notice for me, shame!
		"	2	(Zurich, Family, rich, yes) Bio/Neurofeedback and Self Sustainability | 17.11.2016 19:00 -  21:30	369
42	http://www.englishforum.ch/commercial-events/262188-baar-kanton-zug-family-christlicher-treffpunkt-zugerstrasse-64a-nearly-new-sale-children-s-clothing-toys-0-12-years-12-11-2016-a.html		0	(Baar (Kanton Zug), Family, Christlicher Treffpunkt Zugerstrasse 64a) Nearly New Sale (Children's clothing/toys 0-12 years) | 12.11.2016	514
43	http://www.englishforum.ch/commercial-events/261980-zurich-concert-show-hotel-bar-sch-neggplatz-feldstr-144-free-entry-live-jazz-hotel-bar-05-11-2016-20-00-23-30-a.html	" 
			
			Many thanks to all who ventured out last night; it was lovely to meet so many new faces. We enjoyed the smooth sounds and smooth conversations on a rainy night in the city.    
Our next event is on Thursday:   - sublime minimal tunes brought to you by a three DJ set from the Third Mind Fiasco.   
Everybody welcome, free entry.    
Do introduce yourself if you're stopping by, it would be a pleasure to meet you.       
			
			great night. hopefully it comes soon again.
		"	2	(Zurich, Concert/Show, Hotel Bar, Schöneggplatz, Feldstr. 144, Free Entry) Live Jazz in the Hotel Bar | 05.11.2016 20:00 -  23:30	475
44	http://www.englishforum.ch/commercial-events/262039-basel-family-crossroads-church-reinacherstrasse-129-basel-charity-book-bake-sale-plus-kate-orson-book-signing-05-11-2016-09-00-12-00-a.html		0	(Basel, Family, Crossroads Church, Reinacherstrasse 129) Basel, Charity Book and Bake Sale plus Kate Orson Book Signing | 05.11.2016 09:00 -  12:00	409
45	http://www.englishforum.ch/commercial-events/261999-basel-family-launch-labs-dornacherstrasse-192-basel-autumn-family-flea-market-bake-sale-sat-5th-november-2016-9am-midday-05-11-2016-09-00-12-00-a.html		0	(Basel, Family, Launch Labs, Dornacherstrasse 192) Basel, Autumn Family Flea Market and Bake Sale Sat 5th November 2016 9am- midday | 05.11.2016 09:00 -  12:00	435
46	http://www.englishforum.ch/commercial-events/261977-lausanne-concert-show-cin-ma-obl-avenue-de-france-9-10chf-5chf-reduced-catcave9-monthly-english-science-improv-theater-lausanne-17-11-2016-a.html		0	(Lausanne, Concert/Show, Cinéma Oblò, Avenue de France 9, 10CHF/5CHF reduced) CatCave9: Monthly English Science Improv Theater in Lausanne | 17.11.2016	384
47	http://www.englishforum.ch/commercial-events/261174-aussies-zurich.html	" 
			
			Aussies in Zurich is a group on Facebook which aims to provide a focal point to nuture and network for Australians. IE find some local Aussies to have a beer with. We are trying to get together once a month. Next time is November 4th join the group on Facebook to reserve your place at Outback Lodge at Stadelhofen.
		 
			
			Update, change of date to November 11th.   
Link to the group Australians in Zurich (AiZ)       
			
			Two weeks to go, any takers?
		"	2	Aussies in Zurich	479
48	http://www.englishforum.ch/commercial-events/261664-free-concert-vevey.html	" 
			
			Hi guys and gals,   
There's a free concert in Vevey happening on the 6th of November. Hailing from Kansas, Dark Rooms are a pop band headed by Daniel Hart. Daniel's recently written the soundtrack to the latest Disney animated movie, Peter & the Dragon, as well as Fox's The Exocist. He's also worked with the Polyphonic Spree, Swans, St Vincent, Other Lives. You can find more info on the venu here:   There's a limited number of entrances available, so please email   if you're interested!   
Looks forwarded to seeing you there.   
Chris
		"	0	Free concert in Vevey	368
49	http://www.englishforum.ch/commercial-events/259792-freienstein-zh-exhibition-neues-kino-strickgasse-1-8427-freienst-adults-20chf-kids-free-freestone-fly-fishing-film-festival-05-11-2016-a.html	" 
			
			Breweries include:   
Brauerei Im Berg from Weisslingen 
Schlachthof from Lufingen 
St. Laurentius from Bülach 
Schopfbier from Dielsdorf   
Sorry, no Cardinal, Calanda, Schützengarten, or Feldschlösschen.    
			
			An article in the Zürcher Unterlander about the Festival:         "	2	(Freienstein, ZH, Exhibition, Neues Kino, Strickgasse 1, 8427 Freienst, Adults 20CHF/Kids Free) Freestone Fly Fishing Film Festival | 05.11.2016	674
