	topic	thread	user	views	replies	location	date	post	user_posts	since	exp	thanked	groaned	reputation
1318	Entertainment & dining	Cocktail bars in Lausanne	vikingjente	2117	0	Location: Montreux	14.08.2009, 18:10	" 
			
			Can anyone recommend a good bar/ cocktail bar in Lausanne?
		"	Posts: 10	Join Date: Jul 2009	Newbie 1st class	Groaned at 0 Times in 0 Posts	Thanked 0 Times in 0 Posts	no particular reputation at present
1319	Entertainment & dining	Spare ribs/grill in Bern	dustyfrog	2050	1	Location: Bern	12.08.2009, 15:38	" 
			
			Hrm, if anyone finds out about a place with great bbq ribs - either spare ribs or babyback - particularly if they have specials, I'd love to know.   
Hubby is a fiend for babyback ribs and it would be well worth a day trip to go out for some.     
Maybe someone would be interested in starting up a BBQ place... ?       
Just in case anyone is in the mood for some visual torture, Woody's has pictures on their menu:    "	Posts: 247	Join Date: Aug 2009	Member	Groaned at 6 Times in 1 Post	Thanked 31 Times in 22 Posts	no particular reputation at present
1320	Entertainment & dining	Best Irish pub in Fribourg	zeirtz	3016	1	Location: Bern	12.08.2009, 17:36	" 
			
			Paddy Reilly's in Fribourg does show the Irish football.       
I don't know about the food there but it's not bad in the Zürich and Basel ones.
		"	Posts: 59	Join Date: Jun 2005	Junior Member	Groaned at 2 Times in 2 Posts	Thanked 19 Times in 11 Posts	earned some respect
1321	Entertainment & dining	Sion Guiness Irish Festival aug 6-8	moongoddess	2180	5	Location: Zurich	30.07.2009, 18:59	" 
			
			I loved the irish dancers that were on with the chieftains. Never seen anyone move their legs so fast!    
The guinness itself was a bit of a disappointment. Served in a plastec cup, and poured in advance...criminal!!!   "	Posts: 99	Join Date: Jun 2009	Junior Member	Groaned at 0 Times in 0 Posts	Thanked 31 Times in 22 Posts	made some interesting contributions
1322	Entertainment & dining	Good and reasonable price Restaurant in Geneva	dyana2000	1328	1	Location: Neuchatel	09.08.2009, 01:07	"    I think you should change the approach. First try to consider of what kind your guests are. If they are in favour of nature etc, you might get along the Arve and look out for a nice place, or make an excursion with the whole party onto the Mount Salève. If people rather might like the lake, go to the Southern side and drive into France. A cousin of me who lives in Coppet takes his guests to that area and according to him there is a number of excellent and reasonable restaurants to be found just a few kilometers ""behind"" the border. Even if, thanks to Schengen, passengers and private cars no longer are controlled, people ought to have the identity card with them of course. There are also some nice reasonable restaurants down the Rhône almost at that borderline. You might also go towards the airport and almost to the eastern end of it pass through the tunnel onto the French side into Ferney-Voltaire, where you might find some nice restaurants as well. If however, your guests are civil aviation minded, take the road west of the airport into Meyrin and then go right earliest and move ahead to the cosy and nice restaurant of the Aéro-Club which of course is primarily catering for the general public. You there can chose between indoors, outdoors and served plus outdoors /self-service. The ambiance is unique and typically Genèvoise in the best of all ways.
		"	Posts: 14	Join Date: Oct 2008	Newbie 1st class	Groaned at 0 Times in 0 Posts	Thanked 0 Times in 0 Posts	no particular reputation at present
1323	Entertainment & dining	Karaoke Bar in Zurich	Andee1982	3131	5	Location: Bülach	06.08.2009, 20:17	"    I have been in therapy for months trying to forget that.
		"	Posts: 30	Join Date: Jul 2009	Junior Member	Groaned at 0 Times in 0 Posts	Thanked 2 Times in 2 Posts	no particular reputation at present
1324	Entertainment & dining	Help! Luzern Hotel	glendamwm	994	3	Location: muhen, Aarau	03.08.2009, 18:08	    Make sure to check out their specials... spent a weekend there and it was definitely wonderful - make sure they get a suite overlooking the river, lake and Pilatus, but warn them, there is a church just opposite the River (with bells!!)   	Posts: 527	Join Date: Feb 2008	Forum Veteran	Groaned at 5 Times in 3 Posts	Thanked 251 Times in 120 Posts	earned the respect of many
1325	Entertainment & dining	Swedish anything here in Zürich!!!	kjellme	6758	15	Location: zürich	17.06.2009, 11:54	" 
			
			Someone told me there is something called the Swedish Club in Zurich, but couldn't find it when googling it. Does anyone know anything about this?
		"	Posts: 17	Join Date: May 2009	Newbie 1st class	Groaned at 0 Times in 0 Posts	Thanked 2 Times in 2 Posts	no particular reputation at present
1326	Entertainment & dining	Movies, ratings, dubbing	Bricin	4531	15	Location: Paris	08.03.2008, 17:07	" 
			
			I'm looking forward to this one:         
Helena Bonham Carter as the Red Queen looks splendid.   "	Posts: 49	Join Date: Aug 2007	Junior Member	Groaned at 0 Times in 0 Posts	Thanked 13 Times in 7 Posts	no particular reputation at present
1327	Entertainment & dining	Farm brunch on August 1, Saturday (all cantons)	argus	2433	2	Location: Zug canton (calmly in Cham)	28.07.2009, 13:46	" 
			
			Final bump before the Big Day!   
Happy National Day to all the Swiss on EF.       "	Posts: 3,378	Join Date: Jul 2007	Forum Legend	Groaned at 15 Times in 14 Posts	Thanked 2,550 Times in 1,236 Posts	a reputation beyond repute
1328	Entertainment & dining	Looking for high stakes cash poker	rreist	721	0	Location: Zurich	24.07.2009, 15:48	" 
			
			Hi,   
I'm looking for either a place or a group that plays high-ish stakes (200-2000 buy in) cash games in zug/baar or zurich.  I've used   to play some games, but that's more tournament style stuff.  So, if anyone knows of anything, or is looking for a poker player in their own games, i'm interested.  In the case someone has a social circle that plays and is picky about who they invite - my demographic is early 30s finance professional, grew up in Florida, social guy....and I call EVERYTHING.    "	Posts: 11	Join Date: Jul 2008	Newbie 1st class	Groaned at 3 Times in 2 Posts	Thanked 14 Times in 5 Posts	become a little unpopular
1329	Entertainment & dining	Restaurant in Gland, Rolle,..	lausanne hack	4766	5	Location: La Tour-de-Peilz	10.07.2009, 20:54	" 
			
			""Il Pulcinella"" in Rolle offers very good Italian food. 
You could also try Morges, they have both the Casino and the Hotel Mont Blanc with lakeside terrasses, very nice!
		"	Posts: 43	Join Date: Jul 2008	Junior Member	Groaned at 1 Time in 1 Post	Thanked 5 Times in 5 Posts	no particular reputation at present
1330	Entertainment & dining	English Movies	River10	12618	8	Location: Lausanne	22.07.2009, 23:26	" 
			
			Additional bits of information are available here:        "	Posts: 68	Join Date: May 2009	Junior Member	Groaned at 1 Time in 1 Post	Thanked 24 Times in 16 Posts	made some interesting contributions
1331	Entertainment & dining	[Zurich]Good Home delivery after 11pm	Nanda	9148	9	Location: Zurich	15.08.2007, 13:30	" 
			
			The best delivery pizza in Zurich! 
great pizza, delivered hot, reasonable price, close at 11.30pm   
The Flying Pizza   
Nordstrasse 245, CH-8037 Zürich,  
Tel 01 440 32 32, Fax 01 440 32 34         
hhmmmm
		"	Posts: 813	Join Date: May 2005	Forum Veteran	Groaned at 2 Times in 1 Post	Thanked 168 Times in 114 Posts	earned the respect of many
1332	Entertainment & dining	Open-air Cinema	Easy	3493	9	Location: Staufen	02.06.2009, 22:09	" 
			
			Ah bummer, no orange cinema in Basel this year.  Boo-sucks - I normally really look forward to this   "	Posts: 95	Join Date: Nov 2008	Junior Member	Groaned at 0 Times in 0 Posts	Thanked 24 Times in 20 Posts	no particular reputation at present
1333	Entertainment & dining	Zurich - Restaurant Sternen, very cheap with acceptable quality	juice99	1598	1	Location: Zurich	13.07.2009, 22:10	"    - 
and on each first Friday each month there in the evening is a free Jazz concert of quite a good Jazz band !   Really to be recommended !
		"	Posts: 425	Join Date: Nov 2008	Senior Member	Groaned at 37 Times in 21 Posts	Thanked 119 Times in 60 Posts	earned some respect
1334	Entertainment & dining	Lausanne special occasion restaurant?	sfgal	1790	2	Location: Lausanne	10.07.2009, 10:14	"   Lyrique   rue Beau-Séjour 29  - 1003 Lausanne &lt;/B&gt;
Tél.: 021 312 88 87 - Fax: 021 312 88 92    Méditerranéenne, Végétarienne, Française  "	Posts: 14	Join Date: Feb 2009	Newbie 1st class	Groaned at 0 Times in 0 Posts	Thanked 1 Time in 1 Post	no particular reputation at present
1335	Entertainment & dining	Restaurant review sites	the_old_vase	1671	6	Location: Switzerland	07.12.2006, 17:28	"    Buy the Tages Anzeiger tomorrow. In that middle part with the programs of everything and anything, you each week have some quite good restaurant review pages .  Very useful.
		"	Posts: 10	Join Date: Dec 2006	Banned	Groaned at 0 Times in 0 Posts	Thanked 0 Times in 0 Posts	become a little unpopular
1336	Entertainment & dining	Favourite HD / Bluray films	Grant Green	1105	9	Location: Hegnau	02.07.2009, 19:46	" 
			
			Just watched Jackie Brown on HD and its worth addinh to my list.    
""didnt i blow your mind this time, didnt I...""
		"	Posts: 190	Join Date: Feb 2007	Member	Groaned at 6 Times in 4 Posts	Thanked 63 Times in 32 Posts	earned some respect
1337	Entertainment & dining	"Where to take Guests for a ""Swiss"" dining experience?"	InShan	1653	11	Location: Thalwil	01.07.2009, 13:40	"    i'm pretty sure they have a kids menu in the evening. haven't been for lunch there as it would be the end of my day, too much food, om nom num, home, siesta etc ..... (c;
		"	Posts: 441	Join Date: Oct 2008	Senior Member	Groaned at 5 Times in 5 Posts	Thanked 409 Times in 174 Posts	an excellent reputation
1338	Entertainment & dining	Brazilian food	Carolina	6687	6	Location: Vitznau	15.05.2008, 17:48	" 
			
			I recall this Brazilian place in Geneva, somewhere behind the train station. I used to go there some 15 yrs ago when I last lived in CH. It served some of the BEST grilled Chicken I have ever tasted.    
Grilled in front of your eyes in a big wood fired oven. I know the location I have described is very vague, but would any one know where I'm talking about? Does it still exist?   
Is there any such place in Zürich?
		"	Posts: 8	Join Date: May 2008	Newbie	Groaned at 0 Times in 0 Posts	Thanked 0 Times in 0 Posts	no particular reputation at present
1339	Entertainment & dining	Good Service - Recommendations	Tilia	1178	3	Location: ZH	24.03.2009, 11:53	" 
			
			Restaurant at Hotel Ochsen in Uster.     
Excellent food and excellent service. The waitress spoke English and they even have an English menu should you not be able to read German.   
A very nice place with great food.    
My favourite Pork chops will be found here. Big, fat and juicy!
		"	Posts: 2,545	Join Date: Nov 2007	Forum Legend	Groaned at 71 Times in 37 Posts	Thanked 2,232 Times in 1,025 Posts	a reputation beyond repute
1340	Entertainment & dining	Moules at Les Halles in Zürich, by Escher Wyss Platz	Me Myself &amp; I	3418	15	Location: Züri	01.07.2009, 16:13	" 
			
			Thanks Oldhand, do they have outdoor seating as well?
		"	Posts: 1,007	Join Date: May 2009	Forum Veteran	Groaned at 0 Times in 0 Posts	Thanked 609 Times in 341 Posts	a reputation beyond repute
1341	Entertainment & dining	4th of July activities in Geneva?	Greg D	6594	12	Location: Going from Chicago to Geneva	01.07.2008, 22:51	      your right, Thank your for correcting me.   	Posts: 6	Join Date: Jan 2008	Newbie	Groaned at 0 Times in 0 Posts	Thanked 1 Time in 1 Post	no particular reputation at present
1342	Entertainment & dining	Blues Music?	HarryBosch	1118	3	Location: Deleted Account, Left Forum	11.06.2009, 08:04	" 
			
			You should check the Blue Balls festival in Luzern coming up next week.  Here's  , and here's  .   
Also there's a   coming up in November which is good fun.   
I'm pretty sure there's another night where loads of the bars host live music for the night, but the name escapes me.   
Not Zurich I know, but Luzern is less than an hour away.
		"	Posts: 261	Join Date: Jul 2008	Senior Member	Groaned at 4 Times in 3 Posts	Thanked 252 Times in 123 Posts	an excellent reputation
1343	Entertainment & dining	Party Goers? House Music?	Zurcher	1893	27	Location: Zurich	27.06.2009, 18:32	"    Shamon you lost me there as I am getting old and slow. ""Brown wings"" is some kind of STD?   Are you saying our Zurcher caught something last night?
		"	Posts: 83	Join Date: Jun 2009	Banned	Groaned at 25 Times in 17 Posts	Thanked 40 Times in 27 Posts	considered unworthy
1344	Entertainment & dining	Bio restaurants and wines (Zurich)	DBJ	1582	2	Location: Zurich	29.06.2009, 10:57	" 
			
			Perfect, thanks for the recommendation!
		"	Posts: 31	Join Date: Aug 2006	Junior Member	Groaned at 0 Times in 0 Posts	Thanked 0 Times in 0 Posts	no particular reputation at present
1345	Entertainment & dining	U-21 Euros in Geneva	Mito	692	0	Location: Toronto	28.06.2009, 18:06	" 
			
			Hi,   
I am just wondering whether anyone would recommend a good place to watch the U-21 Euro finals in Geneva.   
Thanks.
		"	Posts: 2	Join Date: Apr 2009	Newbie	Groaned at 0 Times in 0 Posts	Thanked 0 Times in 0 Posts	no particular reputation at present
1346	Entertainment & dining	ZH Restaurant Reccy required	Freebooter	1090	11	Location: Baden-ish	18.06.2009, 12:26	" 
			
			Popping in to Hooters on Langstrasse always cheers me up. Mind you, not comparable to the Hooters girls from Bayside in Miami.
		"	Posts: 178	Join Date: Mar 2009	Member	Groaned at 8 Times in 6 Posts	Thanked 154 Times in 75 Posts	an excellent reputation
1347	Entertainment & dining	Desperado Mexican Restaurant and Bar Birthday promotion	madhubhatt	1775	1	Location: Zurich,Switzerland	18.06.2009, 11:20	" 
			
			The food is free, the drinks are not. And sometimes you get a birthday longdrink instead of the birthday desert. I can recommend the promotion   "	Posts: 12	Join Date: Sep 2007	Newbie 1st class	Groaned at 0 Times in 0 Posts	Thanked 4 Times in 4 Posts	no particular reputation at present
1348	Entertainment & dining	Please recommend sunday brunch for Father's day!!!	mazule	1866	8	Location: Kilchberg	15.06.2009, 14:02	" 
			
			I really like Imagine in Zurich HB especially if you book a table on the terrace. really fresh fruit juices,  fruit, smoked meats, smoked salmon, prawns, bacon, eggs, omlettes, cheeses, yoghurt, cereals, pastries, bread and much more. All teas, coffees, buffet juices are included - sodas and alcohol aren't.   
And I think it is 32 chfs and served from 9-2pm.
		"	Posts: 100	Join Date: Apr 2008	Member	Groaned at 0 Times in 0 Posts	Thanked 30 Times in 16 Posts	considered knowledgeable
1349	Entertainment & dining	Swiss restaurant guide	attalus	2072	0	Location: Basel	12.06.2009, 16:26	" 
			
			Here is a great resource which allows you to rate restaurants all over Switzerland and tag them, a community project. It is on German, but the ratings are numerical and most Tags and descriptions are easy to understand.       
Hope that helps   "	Posts: 97	Join Date: Jun 2009	Junior Member	Groaned at 0 Times in 0 Posts	Thanked 19 Times in 14 Posts	made some interesting contributions
1350	Entertainment & dining	Sonnenberg Restaurant	Time Bandit	1529	7	Location: ZH	09.06.2009, 08:29	" 
			
			""Ooh, a football restaurant? How, er, nice and thoughtful, Dahlink!""   
Really, who had the special treat there?   "	Posts: 21	Join Date: May 2009	Newbie 1st class	Groaned at 4 Times in 2 Posts	Thanked 6 Times in 3 Posts	no particular reputation at present
1351	Entertainment & dining	Urgent - what's the best Thai for an evening meal in Zurich!!??	jackleaves	6232	38	Location: Thalwil	09.06.2009, 14:54	"    Would not do Le Cedre for an anniversary. Esp if the belly-dancer's on but I guess it's a matter of personal taste.
		"	Posts: 38	Join Date: Nov 2008	Junior Member	Groaned at 0 Times in 0 Posts	Thanked 3 Times in 3 Posts	no particular reputation at present
1352	Entertainment & dining	Charity Gospel Concert	jmo77	1142	0	Location: Geneva	09.06.2009, 09:27	" 
			
			Delete. 
Delete. 
Delete. 
Delete. 
Delete.
		"	Posts: 1	Join Date: Jun 2009	Newbie	Groaned at 0 Times in 0 Posts	Thanked 0 Times in 0 Posts	no particular reputation at present
1353	Entertainment & dining	restaurant prices...	Jack	10630	34	Location: zürich	01.02.2006, 20:53	" 
			
			Great post Jack.    
I was just thinking about this the other day. I compared Tiffins on Seefeldstrasse (Thai cafe, very quick service) to my favourite Thai Cafe in Melbourne (Chilli Cafe, cnr of Russell and Bourke Streets). The price difference is pretty much double for the same food.  Sfr 16 vs $8 per meal eg: green chicken curry or chicken stir fry. I've not compared for beef or lamb - I guess it would be a lot more different. The other similarity to these two places is that they are pretty basic, maybe a little bit more with Chilli Cafe - but service in minimal.   
Ok, ingredients are also different but I would say the quality is about the same. I find this fair. I'm probably earning about double what I would earn in Melbourne. So going out for me is about the same.    
I wish I remembered what dishes at indian restaurants cost so I could compare but honestly though, I don't think it's that much more.    
Naturally it's easier to find cheap food in Melbourne (eg) than here but cheap food is here. You just have to know where to look. Just like kebab places - they all cost about the same, but you just have to find the one that has good meat instead of the awful processed slab that they shave off.   
Like groceries - taking a walk to the asian side of town (langstr, badenerstr) you just realise that there are other shops with normal veggies and fruits that are a lot cheaper. Many south indian grocery shops do good fish for less than what you'd pay in Coop/Migros. You just have to go further or live there.  (My parents don't shop locally in Melbourne either)   
I earn higher because my time and effort is worth more. I think it's the same case to pay for the services that I enjoy.     
~ Nanda. 
(who still eats out)
		"	Posts: 625	Join Date: Dec 2005	Forum Veteran	Groaned at 1 Time in 1 Post	Thanked 734 Times in 257 Posts	a reputation beyond repute
1354	Entertainment & dining	Venue needed (~ 30 people, bar, food if possible) [Zurich area]	nik	1560	7	Location: Uitikon	03.05.2009, 20:15	" 
			
			West Side Bar at Limmatplatz will give you exclusivity up to 10 or 11pm (I think) for a min spend at the bar, I know a lot of people who've had parties here as it's quite reasonable.   
Another place is Favorit, it's a shop during the day but you can hire it in the evenings also for a min spend behind the bar, and they don't mind you bringing food (or at least they didn't when I had a party there)      "	Posts: 32	Join Date: Jul 2007	Junior Member	Groaned at 0 Times in 0 Posts	Thanked 14 Times in 8 Posts	made some interesting contributions
1355	Entertainment & dining	cozy casual bars in zurich?	tobijill	10993	15	Location: zurich	23.11.2006, 21:01	"    aka Shamrock
		"	Posts: 1	Join Date: Nov 2006	Newbie	Groaned at 0 Times in 0 Posts	Thanked 0 Times in 0 Posts	no particular reputation at present
1356	Entertainment & dining	English Seminar Choir Basel, Spring Concerts	ling ling	1908	0	Location: Basel	24.05.2009, 23:10	" 
			
			English Seminar Choir 
Musical Director: Michel Uhlmann 
Pianist: Joanne Villiers 
Present       
Guest: Chum's (Irish Groove)   
Sunday, 14 June 2009, 5.00 pm 
Tuesday, 16 June 2009, 7.30 pm   
Schoenes Haus, Nadelberg 6, Basel   
Drinks and Savoury Snacks 
Entrance Free, Donations Welcome
		"	Posts: 12	Join Date: Jan 2009	Newbie 1st class	Groaned at 0 Times in 0 Posts	Thanked 1 Time in 1 Post	no particular reputation at present
1357	Entertainment & dining	URGENT: Where to go tonight - beer in zurich?	jammidge	1267	3	Location: zurich	23.05.2009, 14:47	" 
			
			You can't miss the Cana Bar in the Niederdorf, if only to see the OAP DJ!   
Just for a quickie, like. Then onto the aforementioned places.   "	Posts: 104	Join Date: Nov 2008	Member	Groaned at 1 Time in 1 Post	Thanked 29 Times in 18 Posts	no particular reputation at present
1358	Entertainment & dining	English Theatre	pdgilbert	1494	0	Location: Zürich	23.05.2009, 14:03	" 
			
			The English Theatre Group of Zug present        
Friday 22, Saturday 23, Sunday 24, Friday 29, Saturday 30 May 2009 
@ the Burgbachsaal, Zug   
For tickets please visit:   "	Posts: 3	Join Date: Jul 2008	Newbie	Groaned at 0 Times in 0 Posts	Thanked 0 Times in 0 Posts	no particular reputation at present
1359	Entertainment & dining	best bar/restaurant in Basel to watch the champions league final	Tand5	1084	0	Location: Basel	19.05.2009, 14:04	" 
			
			Can anyone give me some good suggestions for a place in Basel to get some food and drink while watching the CL final? Not too packed would be good - any cuisine type is OK.
		"	Posts: 5	Join Date: May 2009	Newbie	Groaned at 0 Times in 0 Posts	Thanked 0 Times in 0 Posts	no particular reputation at present
1360	Entertainment & dining	Zurich cinemas with movies in English?	Larry2009	9433	7	Location: CH	01.05.2009, 16:27	"    I heard they're starting to dub more and more and it's getting hard to find them in the original language.
		"	Posts: 51	Join Date: Mar 2009	Junior Member	Groaned at 0 Times in 0 Posts	Thanked 7 Times in 5 Posts	earned some respect
1361	Entertainment & dining	New to Zurich (Restaurants around the lake)	JulieSimpson	1340	1	Location: Oberreiden	17.05.2009, 18:30	" 
			
			Lots of options, depending on what you want to eat / drink ... if you get the boat to Zürichhorn, there is a very nice restaurant out over the water there (not the casino - haven't been there, but it could be nice). Had lunch there on my first day in Switzerland, courtesy of my boss, and it was a lovely place to be... sit-down restaurant, though, so conversation will be extremely limited if you're on your own. 
Perhaps it would be worth trying the casino? I don't know... or get some Chinese from the place in the Chinese Garden near there, got some nice stuff on offer (and you can either get it from the takeaway window outside and sit on the grass, or go inside and eat at one of their tables).
		"	Posts: 1	Join Date: May 2009	Newbie	Groaned at 0 Times in 0 Posts	Thanked 0 Times in 0 Posts	no particular reputation at present
1362	Entertainment & dining	Recommend me some restaurants in... Basel	grimmus	1282	1	Location: e	17.05.2009, 09:54	" 
			
			There's one called 'Harmony' opposite Credit Suisse at the Univsität tram stop that's pretty good, mainly Germanic-type food (sausages, rosti etc). 
Another one I know, but can't remember the name of I'm afraid, is next door to McDonalds at Barfüsserplatz. I've had a couple of really nice stews there.   
Hope that helps   "	Posts: 162	Join Date: Mar 2008	Member	Groaned at 1 Time in 1 Post	Thanked 33 Times in 19 Posts	made some interesting contributions
1363	Entertainment & dining	Bars showing Eurovision 09?	Blakey	2216	31	Location: Horgen	07.05.2009, 18:55	" 
			
			Apparently not.  It'll be Graham Norton this year.  The song has been written by Andrew Lloyd Webber so winning the show is a foregone conclusion.  Surely?   
So noone knows of any bars that are showing it then?
		"	Posts: 133	Join Date: Jul 2008	Member	Groaned at 0 Times in 0 Posts	Thanked 34 Times in 22 Posts	no particular reputation at present
1364	Entertainment & dining	Movie tickets discounts?	galinas	3281	10	Location: Bern	28.05.2008, 14:40	"     
Thanks for the reminder - here is a link to the coupon which can be printed out, should you not be able to get your hands on 20min (they are always scooped up by old dears in my area)      "	Posts: 48	Join Date: May 2008	Junior Member	Groaned at 0 Times in 0 Posts	Thanked 4 Times in 4 Posts	no particular reputation at present
1365	Entertainment & dining	West African Restaurants in Zurich	kaye_nd	5502	5	Location: Zurich	05.05.2009, 20:01	" 
			
			...and even when you do find a decent African themed restaurant, they're very often serving Thai Green Curry   Nothing wrong with a good curry, but I do wish those restaurants would seize the opportunity of presenting something a little more authentic. Same same but not all that different...   
En Güete
		"	Posts: 27	Join Date: Aug 2008	Newbie 1st class	Groaned at 0 Times in 0 Posts	Thanked 10 Times in 7 Posts	earned some respect
1366	Entertainment & dining	Vegetarian in Basel	Silver Sorcerer	1660	3	Location: Riehen	30.04.2009, 17:39	" 
			
			On Barfusseplatz you have the Syrian/Lebanese Damas Cafe which does an excellent vegetarian mezze platter (humus, tabouleh, baba ghanouj, falafel, broad beans etc...) served with warm pitta bread.   
Get off the tram at Barfi and head up the hill towards Bankverein and its immediately on your right (2-3 doors from the Puppet Museum).
		"	Posts: 2	Join Date: May 2008	Newbie	Groaned at 0 Times in 0 Posts	Thanked 0 Times in 0 Posts	no particular reputation at present
1367	Entertainment & dining	Poker Winnings	Phos	1177	8	Location: ZRH	28.04.2009, 20:18	"     
Yes, I have.  Its best to get in early on the tables before they get ""broken in"".  Most everybody starts at about the same level.  But later in the evening, some may have massively more, so it gets much more bloody to break in.
		"	Posts: 7,192	Join Date: Aug 2006	Forum Legend	Groaned at 463 Times in 351 Posts	Thanked 9,402 Times in 4,949 Posts	a reputation beyond repute
