	topic	thread	user	views	replies	location	date	post	user_posts	since	exp	thanked	groaned	reputation
413	Entertainment & dining	Help finding a party location needed in/near St. Gallen!	lewibrfc	924	0	Location: bern	06.07.2013, 15:37	" 
			
			We are planning a (quite extravagant) roaring twenties themed party in St. Gallen and are struggling to find a bar/Raum/Mietobjekt which we can rent out for one night in late September and kit out as a Speakeasy. Must fill the following criteria:   
- 150-300 person capacity room and second, smaller cellar/room (or the other way around) 
- External catering  
- Possibility to play loud music until at least 3am (on a weekday) without complaints.   
If anyone has any ideas/tips in general for kitting out a room in speakeasy style, we would be really grateful!   
Thanks
		"	Posts: 81	Join Date: Jan 2011	Junior Member	Groaned at 1 Time in 1 Post	Thanked 67 Times in 23 Posts	made some interesting contributions
414	Entertainment & dining	Custom Birthday Cakes - Bern Area?	annast	2192	2	Location: Basel	02.07.2013, 09:07	    found it, it was one of the glatz confisserie, there is also one in town and you can order your cakes have a look here, they also seem to print pictures on cakes      	Posts: 12	Join Date: Jan 2010	Newbie 1st class	Groaned at 0 Times in 0 Posts	Thanked 2 Times in 2 Posts	no particular reputation at present
415	Entertainment & dining	Albanifest Winterthur	loulou82	3240	16	Location: Zurich	25.06.2010, 16:27	" 
			
			Oh. celebrating Albanus. I thought the Brewery Albani had grown considerably, and expanded into the swiss market, but since its not the case, my old plan is still valid, and I'll be in the mountains.   
Doc.
		"	Posts: 80	Join Date: Nov 2009	Junior Member	Groaned at 0 Times in 0 Posts	Thanked 21 Times in 17 Posts	no particular reputation at present
416	Entertainment & dining	Rooftop restaurant in zürich west.		3713	7	Location: Zürich	16.06.2013, 15:17	" 
			
			I've had lunch there before and I really liked it. They didn't have many options for vegetarians and the menu is small but great location and lovely relaxed atmosphere.
		"	Posts: 3,744	Join Date: Oct 2007	Forum Legend	Groaned at 385 Times in 202 Posts	Thanked 1,178 Times in 756 Posts	m
417	Entertainment & dining	Air-conditioned restaurants in Basel?	Soozie	3045	9	Location: Basel	19.06.2013, 17:48	    I never thought I'd see the day when I would defend GWB   but (strictly in the interest of accuracy, mind   )... Snopes says 'nope'.:    	Posts: 21	Join Date: Jan 2013	Newbie 1st class	Groaned at 3 Times in 1 Post	Thanked 19 Times in 5 Posts	no particular reputation at present
418	Entertainment & dining	Looking for a jazz club  in Luzern	ed_mcgaugh	1979	2	Location: Beromünster LU	18.01.2012, 21:03	" 
			
			Hi Guys! I used to live in Lucerne and always enjoyed listening to jazz at Hotel Montana. They have a beautiful Art Deco bar and used to offer live jazz nearly every evening. I think it's worth checking out!
		"	Posts: 47	Join Date: Feb 2010	Junior Member	Groaned at 6 Times in 6 Posts	Thanked 160 Times in 103 Posts	considered knowledgeable
419	Entertainment & dining	Any places English or Italian speaking to play jazz duo (Sax & Piano)	4_Ni_Ma	1761	2	Location: Lausanne	30.05.2013, 23:30	    Here's our link       	Posts: 46	Join Date: May 2013	Junior Member	Groaned at 10 Times in 4 Posts	Thanked 17 Times in 13 Posts	earned some respect
420	Entertainment & dining	Saxophone and accordion Lausanne	Odile	1225	1	Location: Neuchatel	08.06.2013, 19:34	" 
			
			Between 11am and 12.30.
		"	Posts: 19,641	Join Date: Sep 2010	Forum Legend	Groaned at 386 Times in 287 Posts	Thanked 22,594 Times in 10,192 Posts	a reputation beyond repute
421	Entertainment & dining	Mediterranean restaurants in Bern close to HBF - any recommendations?	Caroline	1138	4	Location: Aroond these parts	04.06.2013, 21:12	" 
			
			Last month we went to Domino, it was very good    
don't go to Papa Joe's, it's rubbish.   "	Posts: 323	Join Date: Mar 2007	Senior Member	Groaned at 1 Time in 1 Post	Thanked 73 Times in 48 Posts	earned some respect
422	Entertainment & dining	Bob Dylan in Montreux	hyperlax	1299	1	Location: Zurich	07.07.2012, 15:39	"    Le Monde is reporting that Bob Dylan is to receive the French ""Legion d'honneur"".       "	Posts: 1	Join Date: Mar 2010	Newbie	Groaned at 0 Times in 0 Posts	Thanked 0 Times in 0 Posts	no particular reputation at present
423	Entertainment & dining	Clubbing in Zurich on Friday, 5/31	Phos	1469	12	Location: ZRH	30.05.2013, 23:34	" 
			
			Have a look here:           
Cheers
		"	Posts: 7,192	Join Date: Aug 2006	Forum Legend	Groaned at 463 Times in 351 Posts	Thanked 9,402 Times in 4,949 Posts	a reputation beyond repute
424	Entertainment & dining	Bollywood Brides in Lucerne	charliecorse	760	0	Location: Lucerne	31.05.2013, 15:58	" 
			
			You now get a second opportunity to come and see the show. We are putting our show on again for 2 nights in Lucerne on June 7th and 8th. 
The show is colourful, fun and completely Bollywood.  
Ticket price is CHF 75.- and includes all you can eat and drink Indian Buffet.   
More information available at   or   "	Posts: 56	Join Date: Aug 2011	Junior Member	Groaned at 0 Times in 0 Posts	Thanked 12 Times in 8 Posts	no particular reputation at present
425	Entertainment & dining	Justin bieber comes to zuerich	cannut	4426	27	Location: canada	03.03.2013, 00:10	"       Pinhead    CFL season starts soon ,he could be the football
		"	Posts: 6,453	Join Date: Jul 2008	Forum Legend	Groaned at 175 Times in 135 Posts	Thanked 5,526 Times in 3,048 Posts	a reputation beyond repute
426	Entertainment & dining	Wedding in Switzerland - Reception Ideas	kev132	7362	11	Location: Zurich	12.06.2012, 14:19	" 
			
			Kev132,   
I can't suggest a suitable reception venue/ location, but wish you the best with your plans.   
Should you decide you want some different entertainment for your reception, I can provide Palm Reading/ Tarot reading, tailored perfectly to both the walk around and table-to-table environment. I also perform Close-Up magic. See   for full details.   
Cheers
		"	Posts: 107	Join Date: Apr 2011	Member	Groaned at 1 Time in 1 Post	Thanked 9 Times in 6 Posts	no particular reputation at present
427	Entertainment & dining	Can't see cinema times for next Friday	Geminder	1344	10	Location: The Dark Side	26.05.2013, 20:49	      I got quite the fright then at the thought my kids might be home for yet another long weekend. So mean!   	Posts: 190	Join Date: Jan 2009	Member	Groaned at 8 Times in 5 Posts	Thanked 88 Times in 51 Posts	annoyed a few people around here
428	Entertainment & dining	Restaurants in the hills near Lorrach that I cant remember	ipoddle	2346	8	Location: basel	22.05.2013, 00:17	" 
			
			My best guess would be Hotel Restaurant Meien which is on Dorfstrasse 49, in Tuellingen above Loerrach.  It has a room with panorama windows - memorable views.  Good menu and quality.  You get to it either from Weil (easiest) or from Loerrach, each way going up a hill.  Hope this helps!
		"	Posts: 757	Join Date: Jan 2008	Forum Veteran	Groaned at 20 Times in 13 Posts	Thanked 619 Times in 271 Posts	earned the respect of many
429	Entertainment & dining	Restaurant Sultan Karthago is gone	Wollishofener	944	4	Location: Glattbrugg	26.05.2013, 08:52	"    YES, to stop people from moving to the place
		"	Posts: 19,029	Join Date: Jun 2009	Forum Legend	Groaned at 333 Times in 258 Posts	Thanked 11,716 Times in 6,858 Posts	a reputation beyond repute
430	Entertainment & dining	Afro Beats/R'n'B/Hip-Hop Night Clubs	Ope	2789	7	Location: Zurich	26.03.2012, 15:43	      	Posts: 72	Join Date: Mar 2012	Junior Member	Groaned at 1 Time in 1 Post	Thanked 9 Times in 6 Posts	no particular reputation at present
431	Entertainment & dining	Carte Bleue	vbv09	2277	8	Location: Zurich	24.02.2013, 01:24	"    You can see this info online - if you log into your Carte Bleue account online, simply click on Mein Account -> Priority-Club (under ""Service"" on the right-hand side).
		"	Posts: 22	Join Date: Feb 2013	Newbie 1st class	Groaned at 0 Times in 0 Posts	Thanked 2 Times in 2 Posts	no particular reputation at present
432	Entertainment & dining	Rob Spence	ThomasT	784	0	Location: The Village	20.05.2013, 03:07	" 
			
			Rob Spence, originally from Australia, who has been living in Switzerland for several years and is among the best known Swiss comedians      "	Posts: 726	Join Date: Jul 2010	Forum Veteran	Groaned at 32 Times in 18 Posts	Thanked 566 Times in 284 Posts	an excellent reputation
433	Entertainment & dining	How to make $1000000 in Switzerland?	IzabelaInZug	1585	12	Location: Zug	19.05.2013, 13:12	" 
			
			I don't exactly see the ROI here.
		"	Posts: 729	Join Date: Oct 2011	Forum Veteran	Groaned at 62 Times in 36 Posts	Thanked 485 Times in 257 Posts	considered knowledgeable
434	Entertainment & dining	Hockey game tonight Switzerland vs USA	Bermudian in Zurich	1449	2	Location: Zurich	18.05.2013, 09:27	" 
			
			Found a nice place - Paddy O'Reilly's.  I would never go to Hooters....it's not appealling both the atmospher, the food, and the overall concept.  Plus, when you are in Zurich...why not find a neighborhood place.  It was a great game - CH beat USA 3:0....I a tidy winnings from some drunk Americans...who were gunho on the fact that USA would win.  I gave them odds up to a score of 2:0 for CH...and they did it.  "	Posts: 2	Join Date: May 2013	Newbie	Groaned at 0 Times in 0 Posts	Thanked 0 Times in 0 Posts	no particular reputation at present
435	Entertainment & dining	Dancing the night away	MacGregor's Daughter	1592	11	Location: Zug	15.03.2012, 13:36	" 
			
			Pasadena is a good place for partner dancing. I've been there on a few Fridays, and they play different styles of music through the night, with a slight bias towards discoswing.   
Silbando and Downtownswing are very good, too, although I only know them through lindy hop. On a similar note, you should check El Social ( ) and the open air dancing on Bürkliplatz, there are different dance styles on different nights.   
Btw, if you want to check Pasadena, I have posted an event for this Friday (17.05). I will be going to Pasadena, and it would be great to have other dancers joining, the more the merrier!   "	Posts: 3,187	Join Date: Oct 2009	Forum Legend	Groaned at 32 Times in 24 Posts	Thanked 3,563 Times in 1,463 Posts	a reputation beyond repute
436	Entertainment & dining	Going out in Zurich this evening	timmalin	1064	1	Location: Zurich	14.05.2013, 16:19	"    Welcome to the forum, and wow... you're very outgoing!     
A word of recommendation, however, its better to ask people to send you a message than to put your personal email out there for all to see!     
Hope you have fun tonight!
		"	Posts: 1	Join Date: May 2013	Newbie	Groaned at 0 Times in 0 Posts	Thanked 0 Times in 0 Posts	no particular reputation at present
437	Entertainment & dining	New in Bern	Leo_DS	1381	2	Location: Bern	10.05.2013, 21:24	" 
			
			Thanks for your reply 
Have a nice day
		"	Posts: 2	Join Date: May 2013	Newbie	Groaned at 0 Times in 0 Posts	Thanked 0 Times in 0 Posts	no particular reputation at present
438	Entertainment & dining	Korean Restaurant in Zurich?	xdorax	19520	26	Location: Zurich	06.02.2008, 02:34	" 
			
			will definitely try one of these out one day   thanks
		"	Posts: 8	Join Date: Feb 2008	Newbie	Groaned at 0 Times in 0 Posts	Thanked 1 Time in 1 Post	no particular reputation at present
439	Entertainment & dining	Swan Lake Reloaded. Highly recommend	Oldhand	2886	4	Location: Zürich	26.04.2013, 10:13	" 
			
			Went again tonight, this time with husband. I saw things i missed the first time. I still cried though. It's on till the 12th....if your dithering, stop it and go!
		"	Posts: 3,845	Join Date: Apr 2006	Forum Legend	Groaned at 20 Times in 19 Posts	Thanked 6,212 Times in 1,919 Posts	a reputation beyond repute
440	Entertainment & dining	Basel-How far would you drive into France for a good meal?	Confloozed	4120	40	Location: Zurich	12.03.2013, 16:04	"     What is your impression of Mulhouse though?    
I would like to do something in Saint Louis but there are a lot of factors. Such as even finding something in the first place.
		"	Posts: 4,708	Join Date: Dec 2007	Forum Legend	Groaned at 135 Times in 119 Posts	Thanked 4,832 Times in 2,300 Posts	a reputation beyond repute
441	Entertainment & dining	mexican restaurants, Geneva ( can you recommend any)	grynch	8072	14	Location: Geneva/Vaud	08.04.2010, 11:03	" 
			
			after looking at ""le chat"" on street view I'm sure that was the one I was thinking of...can't say I'd ever even heard of the one in Servette altho servette itself is just around the corner  from me.    
but thanks,     
G
		"	Posts: 4,976	Join Date: Nov 2006	Forum Legend	Groaned at 59 Times in 55 Posts	Thanked 5,199 Times in 2,354 Posts	a reputation beyond repute
442	Entertainment & dining	Vogue de Jussy 4-5 May	McTAVGE	1967	1	Location: Geneva	30.04.2013, 20:27	" 
			
			It is also the Geneva Marathon, so check out that bus routes are not being affected. Weather is meant to be improving!      "	Posts: 2,000	Join Date: Apr 2010	Forum Veteran	Groaned at 19 Times in 18 Posts	Thanked 2,042 Times in 817 Posts	a reputation beyond repute
443	Entertainment & dining	band/dj for wedding in Lausanne area	melbyeta	2806	6	Location: Lutry	18.03.2013, 23:01	" 
			
			Hi. I am a DJ. Have done most of the weddings posted here on English forum. 
I live in Chateau D-Oex (Vaud) and have vast experience. I won't charge you a travel fee and am willing to meet with you with no obligations. Free quotes, travel and scheduled meetings to tailor music requirements. Excellent equipment and service. Just P.M me and I'll send you references from the happy bridal couples. Kind Regards.Marco
		"	Posts: 2	Join Date: Nov 2012	Newbie	Groaned at 0 Times in 0 Posts	Thanked 0 Times in 0 Posts	no particular reputation at present
444	Entertainment & dining	Looking for traiteur in Lausanne - asian/fusion	marylou	953	0	Location: Lausanne	29.04.2013, 11:31	" 
			
			Hi all,   
for my PhD defense, I am organizing an apéro. I am looking for a traiteur in/around Lausanne that offers good verrines/canapés. I prefer something sophiticated with maybe an Asian twist.  
Unfortunately, the traiteur I wanted to book already has too many events on the given day.    
Any recommendations?
		"	Posts: 13	Join Date: Sep 2012	Newbie 1st class	Groaned at 0 Times in 0 Posts	Thanked 2 Times in 2 Posts	no particular reputation at present
445	Entertainment & dining	Ellie Goulding	jerallie	925	0	Location: Goldiwil	27.04.2013, 21:20	" 
			
			I am looking for anyone who has 2 tickets to the Ellie Goulding at the Harterei Club in Zurich. If anyone has or knows where I can get 2 tickets I would be most grateful.
		"	Posts: 615	Join Date: Feb 2011	Forum Veteran	Groaned at 53 Times in 23 Posts	Thanked 523 Times in 179 Posts	a reputation beyond repute
446	Entertainment & dining	Zurich - going out alone. Is it safe? What would be the best places to go?	Julce	3999	11	Location: Switzerland, canton Aargau	26.04.2013, 15:20	" 
			
			Oh nooo!   
I was waiting down the wrong alleway!!!    
Glad you had fun   "	Posts: 18	Join Date: Jun 2010	Newbie 1st class	Groaned at 0 Times in 0 Posts	Thanked 26 Times in 10 Posts	no particular reputation at present
447	Entertainment & dining	Lebanese Restaurant	karin_z	12945	39	Location: ZRH	22.03.2009, 19:55	"    Come over to my apartment and I'll serve you the best lebanese food   or better, wait a few months when my mum comes over and then you'll really have a taste of lebanon in zurich.   
as mentioned by many Le Cedre is the best in taste but that's only if you haven't tasted the real lebanese food.   
last week we also tried a Lebanese/moroccan restaurant Maison Blunt somewhere close to Langestrasse. the place is not wow but the people are very nice and they do try to please customers. Some of the dishes were very authentic but some others were all mutated versions (not bad but just not the lebanese taste).   
For me the ambiance is as important as the taste so I'd opt for cedre for now until i've tried the others.   
Bon apetite
		"	Posts: 220	Join Date: Apr 2008	Member	Groaned at 2 Times in 2 Posts	Thanked 45 Times in 28 Posts	become a little unpopular
448	Entertainment & dining	Champions League	MathildaDelilah	2574	21	Location: Zumikon	12.02.2013, 13:11	" 
			
			They definitely missed J. Mascherano and C.Puyol.
		"	Posts: 1	Join Date: Feb 2013	Newbie	Groaned at 0 Times in 0 Posts	Thanked 0 Times in 0 Posts	no particular reputation at present
449	Entertainment & dining	Moving to Zurich...	ELdEL	644	0	Location: Between Edinburgh & Zurich	23.04.2013, 12:18	" 
			
			...and looking for a little advice on the club scene.   
So far, I've only had one proper night out in Zurich that involved dancing and one thing I'm keen to ask you all about now is where people recommend to go? All kinds of music as I'm into all sorts of stuff, but not big on shiny commercial things; e.g. Swedish House Mafia, U2 or their equivalent in each scene.     
Does it always cost half a kidney to get into clubs & gigs here?    
What types of music are popular at the moment?    
Is there much of an underground scene?   
Are DJs usually contracted/promote their own nights/paid cash in hand?    
Are there any English speaking DJs out there that may be interested in trying to get a night sorted out somewhere sometime in the future? You can find mixtapes of mine here   and here   please drop me a line if there's anything there that might sit well with what you play and if you'd be interested in having a chat about things.   
Anyways, thanks in advance to anyone who can pass on their thoughts about the above.
		"	Posts: 7	Join Date: Apr 2013	Newbie	Groaned at 5 Times in 2 Posts	Thanked 3 Times in 3 Posts	become a little unpopular
450	Entertainment & dining	Ideas for a good party location in Basel?	Jules in Basel	3178	7	Location: Basel	23.11.2012, 20:01	" 
			
			Check out bohemian manufactory.
		"	Posts: 34	Join Date: Oct 2010	Junior Member	Groaned at 0 Times in 0 Posts	Thanked 27 Times in 17 Posts	no particular reputation at present
451	Entertainment & dining	Theater in English at EPFL @ 2, 4, 5 May	katecgardner	763	0	Location: Lausanne	18.04.2013, 17:28	" 
			
			A fresh offering from our EPFL/UNIL Catalyst theater collective, ""Puppet Theories, or how to stop lying to yourself and accept the inevitable"" is a story of scientists and artists colliding in their struggles for fulfillment and fame. CHF 10/15, reservations à    
For detailed location info, check out    
This is our premiere, self-conceived play with nine excellent characters and no script! Come and invite your friends - support the theater and have fun.
		"	Posts: 14	Join Date: Jul 2009	Newbie 1st class	Groaned at 1 Time in 1 Post	Thanked 1 Time in 1 Post	no particular reputation at present
452	Entertainment & dining	Amazed!  I found a decent restaurant in Basel and it didn't cost 300 CHF	FabrizioM	3318	14	Location: Basel	23.11.2011, 12:16	"    I like Italian but am very fussy.  I go to Italy all the time with my work selling houses there so i am spoilt: plus I can cook   
I love oriental food but that is difficult outside major cities.  here in basel I like Noohn a bvit but not an awful lotnand think that is expensive for what it is.  .  The others that I have tried are really not very good at all   
Favourite might be Lebanese but so far that is London only
		"	Posts: 404	Join Date: Jan 2010	Senior Member	Groaned at 3 Times in 3 Posts	Thanked 365 Times in 185 Posts	an excellent reputation
453	Entertainment & dining	Restaurants in Kontanz, DE	vlad_island	1011	5	Location: Zurich, Switzerland	14.04.2013, 20:44	" 
			
			I went to the Sitara 4 years ago - the food was very good and authentic - the atmosphere, very laid back and family run -i'm sure one of the servers was around 14/15!      is very good, as is   (ate here last Thursday and it was excellent) would be hard to decide between them - the Hafenhale also has a huge informal biergarten in the summer which is constanly full with people drinking beer and enjoying big meals from the self-service grill station.
		"	Posts: 429	Join Date: Jun 2008	Senior Member	Groaned at 39 Times in 20 Posts	Thanked 35 Times in 27 Posts	annoyed a few people around here
454	Entertainment & dining	Amazing Four Course Dinner Friday April 12, 2013	coriolis10	831	0	Location: Zurich	10.04.2013, 11:34	" 
			
			An amazing creative   with other suprises will be held for   please reserve and support a great cause:       Fork and Bottle  ( ,  )      Friday April 12, 2013     CHF 75 (four course meal)!!!!!!!    All proceeds will go to support   which is to change   from a fatal condition into a chronic manageable one ( ). 
Reserve: You can call Fork and Bottle directly or email (044 201 18 17;  ).       !!!!!!!  "	Posts: 2	Join Date: Dec 2010	Newbie	Groaned at 0 Times in 0 Posts	Thanked 0 Times in 0 Posts	no particular reputation at present
455	Entertainment & dining	Good places to go out in Zurich	sara.cro	1620	3	Location: Croatia, Labin	28.03.2013, 16:56	" 
			
			Btw thanks   "	Posts: 11	Join Date: Mar 2013	Newbie 1st class	Groaned at 0 Times in 0 Posts	Thanked 5 Times in 4 Posts	no particular reputation at present
456	Entertainment & dining	Places to visit entertain guests in Luzern?	stacey23	1238	2	Location: zug	17.03.2013, 11:36	" 
			
			Edit/rant: scratch Barcas off the list of good places in Luzern. My recent experience with an apero there was being charged CHF 2,50 apiece for 42 small, thin slices of white bread with some scant and less than average quality toppings. A 'cheese plate' consisted of 2 kinds of cheese, both of the worst quality cheese I have ever had in CH. (Kraft american singles and velveeta would have tasted better.) The service was substandard and the host was rude.  
On a brighter note,  a recent dinner at Zum Wilden Mann makes it, in my opinion, the best restaurant on earth!....
		"	Posts: 7	Join Date: Aug 2012	Newbie	Groaned at 0 Times in 0 Posts	Thanked 0 Times in 0 Posts	no particular reputation at present
457	Entertainment & dining	English speaking theater and stand up	jwolf	936	4	Location: Zurich	29.03.2013, 14:26	"    Spotted by Locals looks like a great general resource. Thanks!
		"	Posts: 10	Join Date: Mar 2013	Newbie 1st class	Groaned at 0 Times in 0 Posts	Thanked 9 Times in 4 Posts	earned some respect
458	Entertainment & dining	Breakfast Birthday suggestions in Basel	noella	4875	10	Location: Rheinfelden AG	30.05.2010, 20:57	" 
			
			I can highly recommend Les Garcons (don't let the fact it sits in put you off). It is a really good place for breakfast, interior is really stylish with a super menu, everything from pancakes to smoked salmon   omelets galore.........      "	Posts: 247	Join Date: Nov 2008	Member	Groaned at 0 Times in 0 Posts	Thanked 154 Times in 93 Posts	made some interesting contributions
459	Entertainment & dining	Argentinian restaurant in BAsel?	argento	6287	23	Location: Basel	15.08.2011, 19:25	" 
			
			Thanks Adrian....El Gaucho is listed on TA as the 35th best restaurant in Lorrach. The 35th best place in New York or Barcelona, I'd visit.....but Lorrach?   "	Posts: 11	Join Date: Jun 2011	Newbie 1st class	Groaned at 0 Times in 0 Posts	Thanked 3 Times in 2 Posts	no particular reputation at present
460	Entertainment & dining	Asian Restaurant in Fribourg?	Stephari	2027	10	Location: Fribourg	11.03.2013, 16:48	"    I'm not  .   
Asked my missus about Tam's Kitchen and she's been there on a couple of FEW outings; she says it's OK, but still prefers Vietnam House or Saigon.
		"	Posts: 82	Join Date: Mar 2013	Junior Member	Groaned at 0 Times in 0 Posts	Thanked 13 Times in 9 Posts	no particular reputation at present
461	Entertainment & dining	St Patrick's Day	yupnya	3903	28	Location: Basel Land Biel Benken	09.03.2010, 18:23	" 
			
			James....that sounds boring.....get out and be proud
		"	Posts: 249	Join Date: Oct 2009	Member	Groaned at 0 Times in 0 Posts	Thanked 68 Times in 45 Posts	considered knowledgeable
462	Entertainment & dining	Ice Skating	Stephari	845	3	Location: Fribourg	11.03.2013, 17:07	"       
Go here and post an introduction so we know who you are   "	Posts: 82	Join Date: Mar 2013	Junior Member	Groaned at 0 Times in 0 Posts	Thanked 13 Times in 9 Posts	no particular reputation at present
463	Entertainment & dining	Any good Brazilian Rodizio Restaurants in Zurich?	mtv	4995	7	Location: Zurich	07.11.2011, 16:38	" 
			
			A brazilian friend just recommended a Churrascaria that only just opened in Dielsdorf:      "	Posts: 120	Join Date: Aug 2011	Member	Groaned at 1 Time in 1 Post	Thanked 86 Times in 31 Posts	earned the respect of many
464	Entertainment & dining	Looking for a caterer for wedding dinner in Zurich	lilyput	938	0	Location: Baden	07.03.2013, 17:11	" 
			
			Hi,    
I am looking for a caterer in Zurich for wedding dinner.    
We are thinking to organize the dinner  in the restaurant but it is too formal then it is not a wedding without an after party! If anybody have any contact of any good caterer ?    
Sharing is caring   "	Posts: 8	Join Date: Feb 2013	Newbie	Groaned at 0 Times in 0 Posts	Thanked 0 Times in 0 Posts	no particular reputation at present
