	topic	thread	user	views	replies	location	date	post	user_posts	since	exp	thanked	groaned	reputation
862	Entertainment & dining	Zurich club with hotties?	Pullrod	7019	56	Location: Milan	19.08.2011, 02:12	"    I will say it  .....this post is useless without photographs!!!!!
		"	Posts: 84	Join Date: Aug 2011	Junior Member	Groaned at 2 Times in 2 Posts	Thanked 77 Times in 37 Posts	no particular reputation at present
863	Entertainment & dining	Sunset Beach Bar in Baden / something close?	Feeper	1398	0	Location: AG	18.08.2011, 18:25	" 
			
			Has anyone been there?  Can't seem to find much about it on the interweb - half of what I have found says that they are showing the football world cup   but other pages indicate it is still running this year.    
Am starting to panic as have a couple of schoolfriends coming out this weekend - had planned a quiet one but their FB posts suggest they are packing for fancy bars   (can't understand it - they've both been to Switz before).  Anyone any thoughts on the sunset beach bar?  Otherwise, any suggestions for what to do in the area this Saturday night.  We're too old for a proper club (pushing 40) but a nice bar with cool drinks and good music would be great.  Will head into Zurich if can't find anthing around here.   
Thanks for any tips! 
Vic 
PS - I had thought of trying Magma in Schinznach since I live near there but other posts on here rave about it being great for smokers and that's put me off a bit.  Not too smokey would be great (though I know that's maybe asking a bit much).
		"	Posts: 20	Join Date: Jan 2011	Newbie 1st class	Groaned at 0 Times in 0 Posts	Thanked 25 Times in 12 Posts	no particular reputation at present
864	Entertainment & dining	Nightlife in Geneva for a tourest	Wez	1742	0	Location: Baar/Zug	18.08.2011, 18:05	" 
			
			Hey guys,    
So I'm going to Geneva for a few days for the first time and wondering where the nightlife ""hotspots"" are for a non French speaking tourist.  
Maybe clubs, but bars and pubs with a good vibe (and people who can speak a bit of English) are more what I'm looking for.    
Thanks   "	Posts: 9	Join Date: Aug 2011	Newbie	Groaned at 0 Times in 0 Posts	Thanked 0 Times in 0 Posts	no particular reputation at present
865	Entertainment & dining	Looking for a live band for a wedding	suze82	1404	2	Location: Zurich	15.08.2011, 23:45	" 
			
			Try BlowJob and the Horns - based out of Chur - you can find them online (although googling is a bit of challenge from a work machine).   
They are good - and do get people dancing.
		"	Posts: 3	Join Date: Feb 2010	Newbie	Groaned at 0 Times in 0 Posts	Thanked 0 Times in 0 Posts	no particular reputation at present
866	Entertainment & dining	Good bars with cheap beer in city? Any tips?	gc2011	5069	24	Location: Meilen	18.07.2011, 11:18	" 
			
			el lokal 
5 francs 
next to it there is Stall 6..wine and beer glass both for 5 francs. 
there are a lot of places where things are cheaper too 
just gotta look and find them out    
Cheers
		"	Posts: 139	Join Date: Jun 2011	Member	Groaned at 0 Times in 0 Posts	Thanked 15 Times in 13 Posts	no particular reputation at present
867	Entertainment & dining	Theaters in English in Zurich???	Fantasmino Formaggino	4388	7	Location: Zurich	07.08.2011, 19:55	" 
			
			Hi r326, thanks for your feedback   . I think I'll definitely check zcc out!
		"	Posts: 4	Join Date: Aug 2011	Newbie	Groaned at 0 Times in 0 Posts	Thanked 0 Times in 0 Posts	no particular reputation at present
868	Entertainment & dining	Premiership in the Mountains?	Caviarchips	963	1	Location: Basel Stadt	13.08.2011, 12:04	"    I bet that chap who runs the English shop in town would be able to help you. He seemed quite keen on football last time I was in there.
		"	Posts: 4,006	Join Date: May 2010	Forum Legend	Groaned at 110 Times in 83 Posts	Thanked 6,677 Times in 2,388 Posts	a reputation beyond repute
869	Entertainment & dining	Any place in Basel that's open all night or most of it	amogles	1833	4	Location: Zurich	11.08.2011, 12:38	"    And you can park free of charge in the white boxes there, I always do & 1 bus stop to the airport!
		"	Posts: 8,420	Join Date: Mar 2008	Forum Legend	Groaned at 141 Times in 122 Posts	Thanked 14,698 Times in 6,251 Posts	a reputation beyond repute
870	Entertainment & dining	Orange Open Air Rocky Horror	eng_ch	2255	12	Location: Richterswil	27.07.2011, 13:33	" 
			
			I'm going and I am totally not dressing up   "	Posts: 1,284	Join Date: Nov 2005	Forum Veteran	Groaned at 4 Times in 4 Posts	Thanked 1,045 Times in 572 Posts	a reputation beyond repute
871	Entertainment & dining	Senna film in Switzerland?	guest	1511	4	null	null	" 
			
			twas very enjoyable
		"	null	null	null	null	null	null
872	Entertainment & dining	Bern clubbing	Phil_MCR	1910	3	Location: Basel	08.08.2011, 18:46	" 
			
			whats going on?? *peeking in and looking around*   "	Posts: 11,535	Join Date: Oct 2009	Forum Legend	Groaned at 246 Times in 157 Posts	Thanked 13,432 Times in 5,712 Posts	a reputation beyond repute
873	Entertainment & dining	Hen/Bachelorette Party - Suppliers/Partners	Minster156	3095	7	Location: Zurich	03.08.2011, 00:08	" 
			
			Hi All,    
Sorry I am back (slight technical problem).....thanks for the welcome to the forum!    
Any suggestions of potential hen/bacherlorette suppliers greatly received.    
Thanks!
		"	Posts: 6	Join Date: Aug 2011	Newbie	Groaned at 0 Times in 0 Posts	Thanked 1 Time in 1 Post	no particular reputation at present
874	Entertainment & dining	Good chinese resturants near Bulach German border	gissa bijoy	2406	3	Location: Gossau ZH	25.05.2011, 14:41	"    Thanks Wollishofener...we had been to Jestetten and went to Chinese restaurant panda ...it was very nice,chinese buffet,Mongolian barbecue and sushi for just 15 chf...but you need to book the table before,as it was very crowded ...Food was very nice...   
here is the link for more information      "	Posts: 70	Join Date: Jul 2009	Junior Member	Groaned at 0 Times in 0 Posts	Thanked 28 Times in 20 Posts	earned some respect
875	Entertainment & dining	William Tell Festspiele Interlaken	Kiwichick	1152	0	Location: zurich	09.08.2011, 09:34	" 
			
			I was thinking of taking the family plus in-laws to this on the weekend ... but it is a tad pricey for all.  I am wondering if any non-German speakers have been and whether it was worth going given the language issue.   
Thanks
		"	Posts: 3	Join Date: May 2009	Newbie	Groaned at 0 Times in 0 Posts	Thanked 0 Times in 0 Posts	no particular reputation at present
876	Entertainment & dining	wedding flowers	andreeac	3010	12	Location: zurich	03.08.2011, 14:20	"    It will be at the end of this month, so I have 3 weeks to find something.
		"	Posts: 8	Join Date: Jun 2011	Newbie	Groaned at 0 Times in 0 Posts	Thanked 0 Times in 0 Posts	no particular reputation at present
877	Entertainment & dining	Fact Sheet #3: Casinos in Switzerland	litespeed	8612	6	Location: Dietikon ZH	21.10.2006, 10:17	"    I like the way you put that LS.  I look at it like this; big risk = big win.  My cherries start at CHF 5.-.  Then down around CHF 50 in the pot I will back it down to CHF 2.- and let it ride.   
Made some big hits on the Dragon Legend lately, of course that is all a luck thing to get the right machine.   
Seen some people drop well over a thousand before any big win comes out of it... then again (as noted earlier) 20 Franks + 2 minutes = CHF 2000.-    
Happy gambling
		"	Posts: 1,854	Join Date: Feb 2006	Forum Veteran	Groaned at 15 Times in 12 Posts	Thanked 2,398 Times in 730 Posts	a reputation beyond repute
878	Entertainment & dining	Haitian/Cape Verdian Restaurants & Dance clubs?	Boston2011	2479	8	Location: Boston, MA	29.07.2011, 03:40	"     
I'm also doing research before I move... Would love to stay in contact with you.   "	Posts: 38	Join Date: Jul 2011	Junior Member	Groaned at 0 Times in 0 Posts	Thanked 5 Times in 5 Posts	no particular reputation at present
879	Entertainment & dining	Review: Onyx Bar Parkhuus, Zurich, 8002	Upthehatters2008	1431	1	Location: In the kitchen at parties.	01.08.2011, 15:17	" 
			
			Um, they paid you CHF450 to listen to Buddha Bar music? Seems about the market rate.   "	Posts: 4,579	Join Date: May 2010	Forum Legend	Groaned at 212 Times in 126 Posts	Thanked 6,078 Times in 2,378 Posts	a reputation beyond repute
880	Entertainment & dining	cheese fondue in Basel	Ant	16305	13	Location: Basel	20.02.2008, 22:47	"    Our local Migros sells Cathedral Cheddar which I often put into a fondue along with Gruyere and Emmenthal.   
I wonder what a fondue with Red Leicester would be like...   
Cheers, 
Nick
		"	Posts: 25	Join Date: Oct 2007	Newbie 1st class	Groaned at 1 Time in 1 Post	Thanked 5 Times in 1 Post	no particular reputation at present
881	Entertainment & dining	Best cinema in Basel	rachel10	3242	4	Location: Basel	18.02.2011, 16:47	    I used to have a girlfriend like that too...    	Posts: 53	Join Date: Apr 2010	Junior Member	Groaned at 1 Time in 1 Post	Thanked 58 Times in 28 Posts	earned some respect
882	Entertainment & dining	Orange Cine Tuesday?	Kirabi	1382	0	Location: Palezieux, Vaud	25.07.2011, 20:53	" 
			
			Hi there   
How does the Orange CineTuesday offer works here in Switzerland? I got the code but can I go and get 2 for 1 tickets for every movie in Lausanne Pathé or just the suggest choice?    
Thanks for your help. 
Kirabi
		"	Posts: 14	Join Date: May 2010	Newbie 1st class	Groaned at 0 Times in 0 Posts	Thanked 1 Time in 1 Post	no particular reputation at present
883	Entertainment & dining	Sharing Food	dakman	14308	74	Location: NYC (heart is split between Switzerland and the Big Apple)	26.10.2009, 21:27	" 
			
			... and never forget the dangers of double dipping...
		"	Posts: 1,877	Join Date: Oct 2007	Forum Veteran	Groaned at 4 Times in 4 Posts	Thanked 901 Times in 543 Posts	a reputation beyond repute
884	Entertainment & dining	Geneva : Le bateau (the boat)	guest	984	0	null	null	" 
			
			Just found that on the ""spotted by locals"" webblog and thought it would be interesting to post it on here.             
go on the blog to read the full article.      "	null	null	null	null	null	null
885	Entertainment & dining	Restaurants in Zurich website guide?	elelow	1384	1	Location: Basel	21.07.2011, 13:55	"     
There you go  "	Posts: 41	Join Date: Sep 2007	Junior Member	Groaned at 0 Times in 0 Posts	Thanked 9 Times in 6 Posts	no particular reputation at present
886	Entertainment & dining	Where to get good Swiss Chocolate desserts in Zurich??	yihan	6369	10	Location: Zurich	05.04.2011, 22:32	" 
			
			I too recommend Sprüngli! U should visit their restaurant on Paradeplatz.
		"	Posts: 9	Join Date: Mar 2011	Newbie	Groaned at 0 Times in 0 Posts	Thanked 0 Times in 0 Posts	no particular reputation at present
887	Entertainment & dining	Sushi place in Nyon?	guest	3435	4	null	null	" 
			
			Hi,   
My personal experience (I'm a great sushi fan) is that neither of the places is worth the price or hardly deserve to call ""sushi"" to what they offer. Personally I find the one on take-away in Manor better, even if still far far away from decent.   
The lack of a decent Japanese place in Nyon has been torturing me for a while but only hope stays a trip to Geneve or Lausanne.   
Sad, very sad.   
DrPoi
		"	null	null	null	null	null	null
888	Entertainment & dining	Geneva's Lake Parade / Lake Sensation july 2011	guest	4245	30	null	null	"    have you seen the weather forecast  ?
		"	null	null	null	null	null	null
889	Entertainment & dining	Alp Restaurant Babental, Schleitheim (Ch-8226)	SwissAstrid	1268	0	Location: near Schaffhausen	11.07.2011, 19:20	" 
			
			I came across a very cute restaurant, for me typically Swiss, family orientated, cows, goats, ducks, nice play ground, great patio with views!   
Alp Restaurant Babental, Schleitheim (Ch-8226), 15 minutes from beringen so about 25 minutes from Schaffhausen      "	Posts: 479	Join Date: Jan 2012	Senior Member	Groaned at 8 Times in 3 Posts	Thanked 169 Times in 69 Posts	an excellent reputation
890	Entertainment & dining	restaurant recommendation.. La Cote ( Vaud )	guest	2340	17	null	null	"     
thanks for the list moose... the only other on your list that I've tried is the  Aerodrome... this was recommended by a friend ... maybe we hit it on a bad day a couple of months ago but were very disappointed both in quality of food and in the service ... I wouldn't take guests there until and unless we go back ourselves
		"	null	null	null	null	null	null
891	Entertainment & dining	Harry Potter!!!!!	tearley	1476	2	Location: Lausanne (Vaud)	11.07.2011, 10:46	" 
			
			Hi Tearley,   
A belated welcome to Lausanne! You can check out the show times for HP on cine.ch       
VO (version originale) will be in English with no subtitles.   
Have fun!
		"	Posts: 428	Join Date: Jan 2011	Senior Member	Groaned at 5 Times in 3 Posts	Thanked 409 Times in 190 Posts	an excellent reputation
892	Entertainment & dining	Business Lunch near Paradeplatz, Zürich?	carcharhinus	4613	3	Location: Greater Zürich Area	02.12.2008, 21:26	" 
			
			hi Martin, I'm not sure what your budget is, but for the Paradeplatz area Bindella springs to mind:    
I've taken people to Buendnerstube before, which is nice because it's a little roomier than other places:    
I haven't been in awhile (hello credit crunch), but I used to quite like this place:    
Bü's is alright:    
Bubbles is right - Brasserie Lipp is also reliably good.   
I've tried Coco's right on Paradeplatz with work contacts before and it was an epic failure. The food's nice and the service is usually attentive, but it's such a small space and gets really, really loud at lunchtime.
		"	Posts: 484	Join Date: Jun 2008	Senior Member	Groaned at 5 Times in 4 Posts	Thanked 226 Times in 141 Posts	considered knowledgeable
893	Entertainment & dining	Zurich reviews blog	Geminder	1469	1	Location: The Dark Side	06.07.2011, 22:07	"    Interesting, but I have to roll my eyes at anyone who mentions Orel Füssli Bookshop without also mentioning that most paperbacks are 30CHF, some more, some less. I download most of my books anymore via amazon/itunes, but if I really wanted to go on a treeware binge, it'd cost me less to fly to london and go crazy for an afternoon on Charring Cross. I dunno, I get a bit irritated with touristy blogs that masquerade as 'hey, we're local!', especially since none of the serious bibliophile I know buy more than the very occasional book from said bookstore.
		"	Posts: 190	Join Date: Jan 2009	Member	Groaned at 8 Times in 5 Posts	Thanked 88 Times in 51 Posts	annoyed a few people around here
894	Entertainment & dining	Indian Food in  Geneva	cbb	18466	13	Location: UK (ex CH)	28.01.2008, 01:16	"    There is such a nice and good Indian restaurant right accross from the Gare Cornavin (nr Rue Mont Blanc) . I will go there again, whenever I prefer that nice Moroccan restaurant just two streets towards the lake.        thanks. The Shahi it was. True, the one those folks in Basel right now have on their program is above, but i have been in the Shahi about three times (since 1990) and I liked the place, each time had either lamb or beef vindaloo, and appreciated it. Geneva still is a very good place with restaurants of many different kinds.     
I when in Geneva in an evening always simply walk around in the Quartier Paquis which I like, and I sometimes see that a nice restaurant is gone, but often detect one I did not see on previous visits. I like it that there are so many Arab places in that quarter now, in an increasing way.
		"	Posts: 419	Join Date: Aug 2007	Senior Member	Groaned at 2 Times in 2 Posts	Thanked 81 Times in 43 Posts	earned the respect of many
895	Entertainment & dining	Basel Zoo Night this Saturday	suzybg	1586	3	Location: Edinburgh/ Basel	01.07.2011, 09:57	" 
			
			We were going to go about 8pm so it will still be light for a while.  I also asked about admission and there are reduced prices after 5pm - 10chf for adults.
		"	Posts: 488	Join Date: Sep 2010	Senior Member	Groaned at 1 Time in 1 Post	Thanked 266 Times in 153 Posts	earned the respect of many
896	Entertainment & dining	Geneva : locals' favorite 2011 outdoor summer bar	guest	2555	4	null	null	"    ok... I feel a little bit ( just a little ) bad about this... we complained to the management service co. that runs this place... and have just found out that they have apparently sacked the manager on site.
		"	null	null	null	null	null	null
897	Entertainment & dining	A Recommendation - Extremely Family Friendly Eating in Vaud	jetset	1464	0	Location: Canton Zurich	30.06.2011, 22:40	" 
			
			Last Sunday we had brunch at La Ferme du Chateau.      
It was delightful! It is set up in such a way that you are able to keep an eye on your children while seating at your table and enjoying the company of your friends and/or family. There is a square yard with tables around the perimeter and then several farm related rid on toys, a swing set, and a playhouse with slide. In addition, there are many fun animals and birds for the children to see - a parrot, llamas, peacocks, and more. The shade availability is also great, which is sometimes a hassle to find for newborns and infants not yet allowed to use sunscreen.   
I will say that the food was not necessarily ""amazing."" Your standard fare of different breads, cheeses, yogurts, eggs, croissants, etc. It was not bad by any means, just nothing spectacular. However, when considering the fact that I was able to leisurely eat my meal and talk to friends for hours without my toddler or infant pitching a fit, they could have served a crap meal and I'd probably still go again.   
Anyhow, two thumbs up. Now I just need to find the equivalent experience in Canton Zurich.
		"	Posts: 279	Join Date: May 2009	Senior Member	Groaned at 5 Times in 2 Posts	Thanked 166 Times in 69 Posts	earned the respect of many
898	Entertainment & dining	Pie Stand at Viadukt	Squeeeez	1654	11	Location: Frauenfeld	20.06.2011, 18:41	" 
			
			Just wanted to add that they also have a shop at the top of Rotbuchstrasse near Schaffhauserplatz.   
And the pies are very good, sehr lecker. This is coming from someone from a town where it is a legal requirement that every high street must have at least one pie shop   "	Posts: 531	Join Date: Feb 2011	Forum Veteran	Groaned at 0 Times in 0 Posts	Thanked 519 Times in 253 Posts	a reputation beyond repute
899	Entertainment & dining	Mexican Food in Oerlikon	chriscd	4541	20	Location: Zurich, Switzerland	24.01.2011, 22:40	" 
			
			3 Amigos is ok, nothing special, but nice if you can sit outside in the square
		"	Posts: 14	Join Date: Jan 2010	Newbie 1st class	Groaned at 0 Times in 0 Posts	Thanked 0 Times in 0 Posts	no particular reputation at present
900	Entertainment & dining	Reggae and Dancehall, Zurich	frens	5788	6	Location: Zurich	24.03.2011, 13:52	" 
			
			Which reminds me...we should plan another reggae outing soon!!!    
Meanwhile, I look forward to seeing you all this weekend for   and perhaps also for    
Love  "	Posts: 16	Join Date: Feb 2011	Newbie 1st class	Groaned at 0 Times in 0 Posts	Thanked 6 Times in 6 Posts	no particular reputation at present
901	Entertainment & dining	Nightlife, Clubs, Dancing in Geneva	GenBound	3137	1	Location: California	26.06.2011, 12:15	" 
			
			The Pickwicks usually have live bands on the weekends and people dance.  I often go there.  There is a good atmosphere and lots of expats.   
Check out their website where they have a calendar of the events.   
Disco's, I don't really know.  Perhaps younger members can help you out there!!
		"	Posts: 2	Join Date: Feb 2011	Newbie	Groaned at 0 Times in 0 Posts	Thanked 0 Times in 0 Posts	no particular reputation at present
902	Entertainment & dining	needing venue and catering help! please!	tmsw	969	0	Location: Horgen, Zurich	23.06.2011, 12:57	" 
			
			Hello! My husband and I are planning our 1st anniversary party for July 31st, I know, leaving it a bit late but we've just found out that my parents and grandparents are coming over from Australia and the US so we thought it'd be nice to throw a party so they can meet all our friends and the extended members of my husbands family.   
Anyway! I'm searching for a venue with very little luck so far- any ideas? It'll be about 30 people, and we'd love an outdoor location, or on the lake or river.   
AND catering! Any and all recommendations are greatly appreciated! Our budget is about 5000chf for the whole thing.....   
thanks!
		"	Posts: 26	Join Date: Jul 2010	Newbie 1st class	Groaned at 0 Times in 0 Posts	Thanked 19 Times in 6 Posts	no particular reputation at present
903	Entertainment & dining	Vegan Pastries?	Carie	1912	7	Location: Lachen	06.06.2011, 01:59	" 
			
			You could also try one of the Asian stores for frozen Indian (or similar) samosas, a bit spicy but delicious. All my samosa recipies are vegan.
		"	Posts: 11	Join Date: Oct 2008	Newbie 1st class	Groaned at 0 Times in 0 Posts	Thanked 1 Time in 1 Post	no particular reputation at present
904	Entertainment & dining	restaurant for wedding dinner needed	esmutepat	2045	11	Location: Zurich	07.06.2011, 12:08	" 
			
			Storchen hotel - Zurich 
ETH Turm - Zurich 
Acqua Restaurant - on lake Zurich. 
Black Swan (?) - big hotel/restaurant on lake in Rapperswil. 
Hyatt Hotel - Zurich   
I have been there for a few weddings and other events - all are first class.
		"	Posts: 22	Join Date: Sep 2009	Newbie 1st class	Groaned at 0 Times in 0 Posts	Thanked 19 Times in 7 Posts	no particular reputation at present
905	Entertainment & dining	dining in Verbier ?	grynch	1472	15	Location: Geneva/Vaud	03.06.2011, 18:13	" 
			
			A bit out of town, local fare, stunning spot:  .  
A classic, if you don't at least stop for a drink you haven't been in town:   (horrid pizzas though, but the plat du jour at lunch is quite decent).     - overpriced (like all) but tasty, good international style food. 
The T-Bar is a nice café/sports bar, where you can stop at lunch for light fare (and Bruce is a fun guy). 
Le Chalet d'Adrien is the local 5 stars, but the café side (le Grenier) offers a nice tartar steak, not too overpriced. 
Off-Shore of course - off season however - bof bof.
		"	Posts: 4,976	Join Date: Nov 2006	Forum Legend	Groaned at 59 Times in 55 Posts	Thanked 5,199 Times in 2,354 Posts	a reputation beyond repute
906	Entertainment & dining	The Thai Restaurant under Cornavin (Geneva) Station: where's it gone?	Gordon Comstock	3399	12	Location: Geneva	18.05.2011, 19:13	"     
But what is the problem with Cornavin ?  I recently discussed the problem with a cousin in Bern. It is obvious that Bern HB by the Bernese is not really accepted as an integral part of the ""inner city of Berne"" while Zch-HB by most ZH-ers IS regarded as integral part of Zch-dtwn.  How is the relationship of the Genevois with Cornavin in modern times really    "	Posts: 284	Join Date: May 2008	Senior Member	Groaned at 0 Times in 0 Posts	Thanked 422 Times in 174 Posts	earned the respect of many
907	Entertainment & dining	Cool spots in Zurich??	danielleAbear	1366	1	Location: Niederlenz	31.05.2011, 19:16	" 
			
			I'd advise you to check out Widder Bar   . The drink mixers absolutely know what they are doing and they sometimes have live music.
		"	Posts: 22	Join Date: May 2011	Newbie 1st class	Groaned at 0 Times in 0 Posts	Thanked 16 Times in 12 Posts	no particular reputation at present
908	Entertainment & dining	Latino club Lausanne	MountainBike	2101	1	Location: Vaud	30.05.2011, 00:32	" 
			
			for dancing? try la movida near the metropole- they have salsa nights and all that goodness  "	Posts: 21	Join Date: May 2011	Newbie 1st class	Groaned at 1 Time in 1 Post	Thanked 8 Times in 5 Posts	no particular reputation at present
909	Entertainment & dining	Family friendly restaurant - Baden Area	motus	1994	2	Location: Widen, AG	23.05.2011, 00:07	" 
			
			In the end we went for Baldegg. 
Nice place, appetizing food, good service. 
only issue was the wind on the terrasse, as we were sitting in the shade and we ended up being real cold by the end of our lunch.   
but nice place, with superb view of the Alps.    
strongly recommend going.   
Many thanks to Crofty for pointing us to this place!   
Motus
		"	Posts: 54	Join Date: Nov 2010	Junior Member	Groaned at 1 Time in 1 Post	Thanked 8 Times in 6 Posts	no particular reputation at present
910	Entertainment & dining	Where to go dancing in Zurich?	VeroFrance	2112	7	Location: Zurich	11.02.2011, 11:01	" 
			
			Would someone like to join me at the Summer Night's Ball?       
I haven't danced for a while and would like to take it up again. Pretty much any style is good (ballroom to hip-hop to disco).
		"	Posts: 3	Join Date: Mar 2010	Newbie	Groaned at 0 Times in 0 Posts	Thanked 0 Times in 0 Posts	no particular reputation at present
911	Entertainment & dining	Indian Delivery in Onex (Geneva)	LondonAl	1342	3	Location: Geneva	26.05.2011, 21:42	" 
			
			Bombay brasserie sunday afternoon, leave the dustbins with relations... Perfick
		"	Posts: 84	Join Date: Mar 2011	Junior Member	Groaned at 2 Times in 1 Post	Thanked 70 Times in 29 Posts	considered knowledgeable
912	Entertainment & dining	Where to go today?	Phil_MCR	1393	3	Location: Basel	24.05.2011, 19:42	    I should have known..a dancer like you does have standards.   	Posts: 11,535	Join Date: Oct 2009	Forum Legend	Groaned at 246 Times in 157 Posts	Thanked 13,432 Times in 5,712 Posts	a reputation beyond repute
913	Entertainment & dining	Improtheatre in Baden	Crofty	1312	2	Location: Near Baden	09.05.2011, 12:12	" 
			
			I didn't go, but I'll look out for them in November now.
		"	Posts: 161	Join Date: Jun 2008	Member	Groaned at 0 Times in 0 Posts	Thanked 122 Times in 68 Posts	earned the respect of many
