	hrefs	replies	threads	views
934	http://www.englishforum.ch/insurance/159436-rental-insurance.html	3	Rental Insurance	806
935	http://www.englishforum.ch/insurance/159115-car-written-off-after-accident.html	6	car written off after accident	1,767
936	http://www.englishforum.ch/insurance/144812-assura-website-problem-downloading-claim-form-26th-april-2012-a.html	5	Assura Website : Problem downloading claim form (26th April 2012)	2,169
937	http://www.englishforum.ch/insurance/158827-gadgets-bought-switzerland-need-insurance-uk.html	8	Gadgets bought in Switzerland - need insurance for UK	1,505
938	http://www.englishforum.ch/insurance/158875-health-insurance-last-3-months-2012-a.html	1	Health insurance for the last 3 months of 2012?	994
939	http://www.englishforum.ch/insurance/158823-babysitter-childminder-insurance.html	1	Babysitter/ Childminder insurance	826
940	http://www.englishforum.ch/insurance/158441-krankenkasse-how-use-card.html	2	Krankenkasse - how to use the card?	1,656
941	http://www.englishforum.ch/insurance/105344-home-insurance-suggestions.html	2	Home Insurance suggestions	1,381
942	http://www.englishforum.ch/insurance/109373-how-cancel-health-insurance.html	9	How to cancel health insurance	5,622
943	http://www.englishforum.ch/insurance/158039-exemption-health-insurance-ch.html	17	Exemption of Health Insurance in CH	2,585
944	http://www.englishforum.ch/insurance/156443-when-2013-health-insurance-premiums-due-announced.html	12	When are 2013 Health Insurance premiums due to be announced.	1,588
945	http://www.englishforum.ch/insurance/157927-sanagate-bill-procedure.html	4	Sanagate bill procedure??	1,522
946	http://www.englishforum.ch/insurance/157915-need-help-terminating-insurance.html	2	Need Help Terminating Insurance	720
947	http://www.englishforum.ch/insurance/157880-surgery-cost-canton-differences-being-charged.html	3	Surgery cost - Canton differences being charged	1,168
948	http://www.englishforum.ch/insurance/154427-canceling-car-insurance.html	7	Canceling Car Insurance	2,128
949	http://www.englishforum.ch/insurance/108314-do-you-need-swiss-health-insurance-if.html	23	Do you need Swiss health insurance if.......	5,463
950	http://www.englishforum.ch/insurance/157573-when-health-insurance-must-start.html	1	When the Health Insurance must start?	851
951	http://www.englishforum.ch/insurance/12429-september-30th-health-insurance-deadline.html	14	September 30th [health insurance deadline]	2,607
952	http://www.englishforum.ch/insurance/157606-vacating-partment-w-o-serving-notice.html	8	Vacating partment w/o serving notice	740
953	http://www.englishforum.ch/insurance/157440-accidental-damage-cover-rented-flat.html	6	Accidental damage cover for rented flat	2,861
954	http://www.englishforum.ch/insurance/157184-basic-complimentary-health-insurance-different-companies.html	2	Basic and complimentary health insurance in different companies	1,837
955	http://www.englishforum.ch/insurance/157337-travel-insurance-repatriation-uk.html	0	Travel Insurance - Repatriation to the UK	667
956	http://www.englishforum.ch/insurance/156243-additional-health-insurance-private-hospital-mexico.html	7	Additional health insurance for private hospital in mexico	1,109
957	http://www.englishforum.ch/insurance/157203-attorney-wanted-lausanne-vicinity.html	1	Attorney wanted, Lausanne vicinity	585
958	http://www.englishforum.ch/insurance/157098-why-i-am-paying-different-premium.html	5	Why I am paying at a different premium?	760
959	http://www.englishforum.ch/insurance/156815-repetitive-strain-injury-unfall-krankheit.html	2	Repetitive Strain Injury.... Unfall or Krankheit?	1,321
960	http://www.englishforum.ch/insurance/156763-accident-insurance-can-we-buy-without-health-insurance.html	3	Accident insurance -- can we buy it without health insurance	1,499
961	http://www.englishforum.ch/insurance/154245-cancelling-supplementary-cover-groupe-mutuel.html	6	Cancelling supplementary cover with Groupe Mutuel	2,174
962	http://www.englishforum.ch/insurance/155882-frontalier-health-insurance.html	2	Frontalier Health Insurance	2,939
963	http://www.englishforum.ch/insurance/156113-cheap-house-content-insurance.html	2	cheap house content insurance ?	933
964	http://www.englishforum.ch/insurance/154378-medical-insurance-companies-avoid.html	9	Medical insurance companies to avoid?	2,195
965	http://www.englishforum.ch/insurance/156120-pharmacist-not-sure-if-medication-would-reimbursed-insurance-what-do.html	4	Pharmacist was not sure if medication would be reimbursed by insurance... what to do?	1,164
966	http://www.englishforum.ch/insurance/156007-quality1-used-car-guarantee.html	3	Quality1 Used Car Guarantee	2,879
967	http://www.englishforum.ch/insurance/155827-car-insurance-french-registered-car.html	5	Car insurance for French registered car	2,380
968	http://www.englishforum.ch/insurance/155042-3rd-party-liability-house-hold-insurance.html	15	3rd party liability/house hold insurance	5,465
969	http://www.englishforum.ch/insurance/155762-accident-insurance-card-mandatory.html	6	Accident insurance card - mandatory?	1,146
970	http://www.englishforum.ch/insurance/66840-health-insurance-refusing-pay-accident.html	26	Health insurance refusing to pay for accident	3,480
971	http://www.englishforum.ch/insurance/150695-making-claim-household-insurance.html	4	Making A claim on household insurance	1,668
972	http://www.englishforum.ch/insurance/155581-lamal-premiums.html	0	LAMal and Premiums	773
973	http://www.englishforum.ch/insurance/155557-swiss-global-insurance.html	0	Swiss Global Insurance	1,121
974	http://www.englishforum.ch/insurance/132900-giving-birth-switzerland.html	13	giving birth in Switzerland	4,983
975	http://www.englishforum.ch/insurance/155328-health-insurance-frontalier.html	1	Health Insurance - Frontalier	958
976	http://www.englishforum.ch/insurance/154170-insurance-student-s-spouse.html	3	insurance for student's spouse	642
977	http://www.englishforum.ch/insurance/154870-exemptation-swiss-health-insurance.html	8	exemptation of swiss health insurance	2,359
978	http://www.englishforum.ch/insurance/155068-insurance-companies-avoid.html	1	Which insurance companies to AVOID	1,824
979	http://www.englishforum.ch/insurance/154554-woman-health-insurance.html	8	Woman health insurance?	953
980	http://www.englishforum.ch/insurance/153468-car-insurance-cover-uk-car-ch-6-months.html	19	Car Insurance to cover UK car in CH for 6 months	1,865
981	http://www.englishforum.ch/insurance/151459-urgent-health-insurance-date-entry-please-help.html	17	Urgent: Health insurance from date of entry? Please help!	1,992
982	http://www.englishforum.ch/insurance/154304-pregrant-insurance-do-you-suggest.html	21	Pregrant - Which Insurance do you suggest	2,682
983	http://www.englishforum.ch/insurance/154501-car-insurance-help.html	9	Car Insurance Help	1,440
984	http://www.englishforum.ch/insurance/154344-health-insurance.html	2	Health insurance	765
985	http://www.englishforum.ch/insurance/154429-hints-insurance.html	0	Hints for Insurance	715
986	http://www.englishforum.ch/insurance/83393-everything-about-basic-health-insurance-pdf.html	4	Everything about Basic health insurance in a PDF	3,414
987	http://www.englishforum.ch/insurance/153180-travel-insurance-covered-health-insurance.html	14	Travel Insurance (covered by Health Insurance?)	3,447
988	http://www.englishforum.ch/insurance/152142-giving-birth-us-covered-swiss-health-insurance.html	22	Giving birth in the US - covered by Swiss health insurance?	3,730
989	http://www.englishforum.ch/insurance/153892-maximum-possible-excess-deductible-cheaper-health-insurance.html	5	The maximum possible excess/deductible for cheaper health insurance	1,951
990	http://www.englishforum.ch/insurance/153932-franchise-validaty-period.html	5	franchise validaty period	834
991	http://www.englishforum.ch/insurance/149829-looking-health-insurance.html	9	Looking for health insurance	1,124
992	http://www.englishforum.ch/insurance/153880-basic-question-insurance-pregnancy.html	2	Basic Question on insurance and pregnancy	1,261
993	http://www.englishforum.ch/insurance/152594-generali-good-one-opt.html	7	Generali is good one to opt.	1,643
994	http://www.englishforum.ch/insurance/153608-swisscare-big-trouble.html	14	Swisscare - big trouble	3,565
995	http://www.englishforum.ch/insurance/153348-daughter-sick-u-s-swiss-health-insurance.html	14	Daughter sick - U.S. or Swiss health insurance?	1,948
996	http://www.englishforum.ch/insurance/153472-birth-defect-medicine-list.html	1	Birth Defect Medicine List	579
997	http://www.englishforum.ch/insurance/152369-nanny-housekeeper-insurance.html	2	nanny/housekeeper insurance	1,023
998	http://www.englishforum.ch/insurance/151758-advice-basic-health-insurance-cover.html	9	Advice on the basic health insurance cover	2,847
999	http://www.englishforum.ch/insurance/153217-temporary-health-insurance-during-gap-employment.html	4	Temporary Health insurance during gap in employment	1,647
1000	http://www.englishforum.ch/insurance/152900-moved-out-apartment-use-liability-insurance.html	9	Moved out of apartment - use of liability insurance	2,607
1001	http://www.englishforum.ch/insurance/152976-new-switzerland-health-insurance.html	8	New to Switzerland, health insurance?	2,130
1002	http://www.englishforum.ch/insurance/91960-living-working-switzerland-eu-based-company-health-insurance-advice.html	14	Living and working in Switzerland for an EU-based company - health insurance advice?	3,115
1003	http://www.englishforum.ch/insurance/152535-what-insurance-given-i-am-leaving-ch-travels.html	3	What insurance, given that I am leaving CH for travels?	795
1004	http://www.englishforum.ch/insurance/152711-uk-european-health-insurance-card.html	5	UK European Health Insurance card	1,487
1005	http://www.englishforum.ch/insurance/139515-health-insurance-companies-all-documents-english.html	11	Health insurance companies with all documents in English	2,750
1006	http://www.englishforum.ch/insurance/152447-question-regarding-hospital-benefit-insurance-spitaltaggelbversicherung.html	8	a question regarding Hospital Benefit Insurance (Spitaltaggelbversicherung)	957
1007	http://www.englishforum.ch/insurance/152277-help-insurance-dilemma.html	4	Help - Insurance dilemma	904
1008	http://www.englishforum.ch/insurance/152242-looking-insurance.html	3	looking for an insurance	793
1009	http://www.englishforum.ch/insurance/152181-sports-therapy-registration-governing-body-insurance.html	1	Sports Therapy - registration/governing body/insurance	1,283
1010	http://www.englishforum.ch/insurance/152156-insurance-change-innova-vivacare-swica-basic.html	1	Insurance change from Innova to VivaCare, Swica for basic	1,562
1011	http://www.englishforum.ch/insurance/151914-health-insurance-costs.html	35	health insurance costs	2,336
1012	http://www.englishforum.ch/insurance/152084-separate-basic-suplementary-health-insurance.html	1	Separate basic and suplementary health insurance	842
1013	http://www.englishforum.ch/insurance/151609-another-ahv-related-question.html	2	Another AHV related question	772
1014	http://www.englishforum.ch/insurance/152045-health-insurance-asthmatic.html	3	Health insurance - asthmatic	688
1015	http://www.englishforum.ch/insurance/151937-disability-insurance-do-they-cover-you-pre-existing-conditions.html	2	Disability Insurance - do they cover you for pre-existing conditions ?	978
1016	http://www.englishforum.ch/insurance/151394-medical-care-prior-enrolling-insurance.html	3	Medical care prior to enrolling in insurance?	845
1017	http://www.englishforum.ch/insurance/151070-who-pays.html	27	who pays?	2,282
1018	http://www.englishforum.ch/insurance/151051-maternity-insurance-coverage.html	1	Maternity Insurance Coverage	1,193
1019	http://www.englishforum.ch/insurance/150330-hailstone-damage-cars.html	14	Hailstone damage to cars	2,536
1020	http://www.englishforum.ch/insurance/150961-car-health-insurance.html	4	Car and health insurance	1,015
1021	http://www.englishforum.ch/insurance/150974-what-kind-insurance-covers-hail-damage-car.html	8	What kind of insurance covers HAIL Damage on Car?	1,607
1022	http://www.englishforum.ch/insurance/150842-medical-insurance-advice-parttime-resident.html	0	Medical insurance advice for a parttime resident	700
1023	http://www.englishforum.ch/insurance/77848-eca-insurance-natural-elements.html	27	ECA - Insurance of Natural Elements	12,701
1024	http://www.englishforum.ch/insurance/150435-rc-menage-liability-insurance.html	31	RC-Menage/Liability insurance	2,535
1025	http://www.englishforum.ch/insurance/150661-pet-scan-oncology-checkups-basic-health-insurance.html	3	PET scan / oncology checkups with basic health insurance?	1,567
1026	http://www.englishforum.ch/insurance/150498-short-term-motorcycle-insurance.html	8	Short term motorcycle insurance?	1,474
1027	http://www.englishforum.ch/insurance/150403-health-insurance-mandatory-switzerland-supplementary-abroad.html	3	Health Insurance: Mandatory in Switzerland, Supplementary Abroad?	2,279
1028	http://www.englishforum.ch/insurance/150243-smoker-definition.html	13	'Smoker' definition	1,211
1029	http://www.englishforum.ch/insurance/149432-motorcycle-transit-insurance.html	3	motorcycle transit insurance	785
1030	http://www.englishforum.ch/insurance/148971-insurance-claiming-money-back-what-do.html	9	Insurance claiming money back. What to do?	1,168
1031	http://www.englishforum.ch/insurance/149652-student-health-insurance-subsidy-ends-after-six-years-rant.html	24	Student Health Insurance Subsidy Ends After Six Years Rant	2,479
1032	http://www.englishforum.ch/insurance/148974-working-switzerland-but-living-eu-country.html	5	Working in Switzerland but living in EU country	1,637
1033	http://www.englishforum.ch/insurance/138187-insurance-cover-pregnancy.html	23	Insurance cover for pregnancy	5,796
1034	http://www.englishforum.ch/insurance/149139-question-regarding-car-accident-insurance-claim-process.html	2	Question regarding Car accident insurance claim process	1,963
1035	http://www.englishforum.ch/insurance/149024-health-insurance-coverage.html	1	Health Insurance Coverage	883
1036	http://www.englishforum.ch/insurance/128138-cancel-car-insurance-if-there-price-increase.html	42	cancel car insurance if there is a price increase?	5,270
1037	http://www.englishforum.ch/insurance/148515-any-insurance-geneva-cover-ivf-cost.html	12	Any Insurance in Geneva cover IVF cost?	1,837
1038	http://www.englishforum.ch/insurance/148571-insurance-cross-border-commuters.html	0	Insurance for cross border commuters	1,318
1039	http://www.englishforum.ch/insurance/148139-supplementary-health-insurance.html	4	Supplementary Health Insurance	1,772
1040	http://www.englishforum.ch/insurance/147545-velo-vignette-valid-till-may-31-2012-a.html	17	Velo Vignette valid till May 31 2012	2,673
1041	http://www.englishforum.ch/insurance/148235-delay-buy-insurance.html	5	The delay to buy the insurance	1,055
1042	http://www.englishforum.ch/insurance/148146-help-how-do-i-obtain-insurance-uk-car-swiss-driving-licence.html	1	Help : How do I obtain Insurance on UK car with Swiss Driving Licence	1,198
1043	http://www.englishforum.ch/insurance/148134-increase-car-insurance-policy.html	0	Increase in Car Insurance Policy	1,441
1044	http://www.englishforum.ch/insurance/147841-paying-mand-hi-home-state-obliged-have-hi-ch.html	6	[Paying mand. HI in home state] Obliged to have a HI in CH?	2,058
1045	http://www.englishforum.ch/insurance/143620-health-care-advice.html	13	Health care advice	1,905
1046	http://www.englishforum.ch/insurance/146996-approximate-cost-health-insurance.html	12	approximate cost of health insurance?	5,650
1047	http://www.englishforum.ch/insurance/147508-tips-good-supplementary-dental-insurance.html	7	Tips for a good supplementary dental insurance?	2,337
1048	http://www.englishforum.ch/insurance/140683-insurance-baby.html	13	Insurance for baby	2,885
1049	http://www.englishforum.ch/insurance/147493-health-insurance-cover-non-working-spouse.html	2	Health insurance cover for non working spouse	2,065
1050	http://www.englishforum.ch/insurance/147292-visana-sana24-health-insurance-cards-when-use.html	4	Visana and Sana24 health insurance cards: when to use?	2,406
1051	http://www.englishforum.ch/insurance/145724-health-insurance-living-france-but-working-switzerland.html	4	Health insurance in living in France but working in Switzerland	2,819
1052	http://www.englishforum.ch/insurance/147000-paying-up-front-prescriptions.html	6	paying up front for prescriptions?	1,315
1053	http://www.englishforum.ch/insurance/146616-patient-confidentiality-helsana.html	5	Patient confidentiality / Helsana	1,663
1054	http://www.englishforum.ch/insurance/146882-tese-testicular-sperm-extraction-covered-insurance.html	27	TESE, testicular sperm extraction, covered by insurance?	3,512
1055	http://www.englishforum.ch/insurance/146739-new-arrival-taking-infant-see-doctor.html	4	New arrival taking an infant to see a doctor	832
1056	http://www.englishforum.ch/insurance/146669-i-drive-friend-s-car-do-i-need-insurance.html	23	I Drive a Friend's Car - Do *I* need Insurance?	2,980
1057	http://www.englishforum.ch/insurance/146709-switzerlanded-health-insurance.html	6	Switzerlanded on Health Insurance	1,977
1058	http://www.englishforum.ch/insurance/146583-cleaning-lady-accident-insurance.html	7	Cleaning lady and accident insurance	2,458
1059	http://www.englishforum.ch/insurance/145927-cheapest-insurance-z-rich-year-2012-a.html	4	Cheapest insurance Zürich in year 2012	988
1060	http://www.englishforum.ch/insurance/145946-central-database-health-insurance-policies.html	3	central database of health insurance policies?	845
1061	http://www.englishforum.ch/insurance/146247-health-insurance-changing-canton.html	1	Health insurance on changing canton	1,552
1062	http://www.englishforum.ch/insurance/146286-mid-year-subscribed-insurance.html	1	Mid year subscribed insurance	698
1063	http://www.englishforum.ch/insurance/146394-health-care-health-insurance-customs-american.html	5	health care/ health insurance/customs/American	3,072
1064	http://www.englishforum.ch/insurance/118795-worth-fight-mondial-easyjet-travel-insurance.html	13	Worth the fight? Mondial/EasyJet Travel Insurance	3,696
1065	http://www.englishforum.ch/insurance/145834-question-about-legal-insurance.html	5	Question about legal insurance	1,045
1066	http://www.englishforum.ch/insurance/145716-health-insurance.html	1	health insurance	682
1067	http://www.englishforum.ch/insurance/145662-helvatia-auto-insurance.html	1	Helvatia auto insurance	1,554
1068	http://www.englishforum.ch/insurance/144088-motorbike-quote-good-bad.html	19	Motorbike quote: good/bad?	1,548
1069	http://www.englishforum.ch/insurance/145491-valid-insurance-agency.html	0	Valid Insurance Agency	648
1070	http://www.englishforum.ch/insurance/145381-student-can-not-get-student-insurance.html	2	A student can not get student insurance???	1,142
1071	http://www.englishforum.ch/insurance/144095-travel-insurance-tanzania-kilimanjaro.html	7	travel insurance, tanzania, kilimanjaro	1,273
1072	http://www.englishforum.ch/insurance/118601-life-assurance.html	23	Life assurance	3,719
1073	http://www.englishforum.ch/insurance/145299-dealing-uk-car-insurance-after-switzerland.html	1	Dealing with UK Car Insurance after Switzerland	926
1074	http://www.englishforum.ch/insurance/123038-assura-health-insurance-system.html	16	Assura Health Insurance system	8,411
1075	http://www.englishforum.ch/insurance/145054-car-insurance-word-warning.html	4	Car insurance - word of warning	1,185
1076	http://www.englishforum.ch/insurance/140040-exceptional-mid-year-health-insurance-increases-egk.html	32	Exceptional mid-year health insurance increases with EGK	3,552
1077	http://www.englishforum.ch/insurance/144738-does-purchase-contacts-go-towards-your-annual-franchise.html	3	does the purchase of contacts go towards your annual franchise?	660
1078	http://www.englishforum.ch/insurance/144688-ehic-cards-eu-country-now-living-here-how-update-your-ehic-card.html	13	EHIC cards: from and EU country, now living here - how to update your EHIC card	2,076
1079	http://www.englishforum.ch/insurance/144334-ahv-possibly-unpaid-present-employer.html	2	AHV possibly unpaid by present employer	1,313
1080	http://www.englishforum.ch/insurance/144225-health-insurance-home-country.html	2	Health insurance from home country	749
1081	http://www.englishforum.ch/insurance/135277-claiming-stolen-bike-no-proof.html	19	Claiming for a stolen bike with no proof	3,699
1082	http://www.englishforum.ch/insurance/143996-using-doctors-insurance-system.html	12	Using the doctors and insurance system	2,909
1083	http://www.englishforum.ch/insurance/142306-help-can-t-find-car-insurance.html	7	Help! Can't find car insurance!	1,770
1084	http://www.englishforum.ch/insurance/143665-health-insurance-visitor.html	1	Health insurance for the visitor	837
1085	http://www.englishforum.ch/insurance/131187-generali-funny-unprofessional.html	7	Generali -- funny or unprofessional?	2,301
1086	http://www.englishforum.ch/insurance/142167-i-need-help-health-insurance.html	12	I need help with health insurance	1,569
1087	http://www.englishforum.ch/insurance/143275-do-i-need-health-insurance-can-i-use-ehic.html	3	Do I need health insurance? Or can I use EHIC	1,394
1088	http://www.englishforum.ch/insurance/141386-car-insurance.html	14	car insurance	1,653
1089	http://www.englishforum.ch/insurance/142982-using-traveler-s-insurance-switzerland.html	2	using traveler's insurance in Switzerland	840
1090	http://www.englishforum.ch/insurance/138215-medical-insurance-proposal-swiss-student-visa.html	3	Medical Insurance Proposal for a Swiss Student Visa	1,133
1091	http://www.englishforum.ch/insurance/72726-recommendation-english-speaking-insurance-broker.html	22	Recommendation for an English speaking Insurance Broker	6,534
1092	http://www.englishforum.ch/insurance/136227-ahv-entitlement-question.html	12	AHV ( entitlement ) question	5,026
1093	http://www.englishforum.ch/insurance/142560-travel-insurance.html	5	Travel Insurance	1,223
1094	http://www.englishforum.ch/insurance/142474-very-quick-question-about-r-ckforderungsbelege.html	2	very quick question about rückforderungsbelege	767
1095	http://www.englishforum.ch/insurance/136648-high-risk-pregnancy-insurance-suggestions-when-moving-switzerland.html	6	High Risk Pregnancy - Insurance Suggestions when moving to Switzerland	1,982
1096	http://www.englishforum.ch/insurance/141303-important-zurich-announcement-about-insuring-foreign-registered-motor-vehicles.html	11	IMPORTANT Zurich announcement about insuring foreign registered motor vehicles	2,425
1097	http://www.englishforum.ch/insurance/141928-one-question-about-peroid-notice-unemployment-insurance.html	0	One question about 'Peroid of notice' for unemployment insurance.	805
1098	http://www.englishforum.ch/insurance/90566-haftpflictversicherung-personal-liability-insurance-moving-apartment.html	4	Haftpflictversicherung [personal liability insurance] - moving apartment	2,410
1099	http://www.englishforum.ch/insurance/141561-health-insurance-claims-tips.html	0	Health Insurance Claims - Tips	924
1100	http://www.englishforum.ch/insurance/141213-any-price-differences-car-insurances.html	13	Any price differences in car insurances	1,178
1101	http://www.englishforum.ch/insurance/141410-health-insurance-never-received-invoice-hospital.html	2	Health Insurance never received the invoice from the hospital!	1,162
1102	http://www.englishforum.ch/insurance/96154-helpful-insurance-translation-tool.html	6	Helpful insurance translation tool	4,335
1103	http://www.englishforum.ch/insurance/140868-ehic-european-health-insurance-card.html	8	EHIC ( European Health Insurance Card )	2,318
1104	http://www.englishforum.ch/insurance/140638-contraception-question.html	47	Contraception Question	3,808
1105	http://www.englishforum.ch/insurance/140665-divorcing-insurance-company.html	2	"""Divorcing"" an insurance company"	718
1106	http://www.englishforum.ch/insurance/140592-health-insurance-praemienverbilligung.html	2	Health Insurance - Praemienverbilligung	928
1107	http://www.englishforum.ch/insurance/139918-changing-franchise-health-insurance.html	8	Changing Franchise on health insurance	2,269
1108	http://www.englishforum.ch/insurance/138597-swisscare-insurance-help.html	5	SwissCare insurance HELP	2,442
1109	http://www.englishforum.ch/insurance/140205-minor-accident-get-money-instead-repair.html	4	Minor Accident - get money instead of repair?	1,185
1110	http://www.englishforum.ch/insurance/140052-basic-insurance-holder-want-go-private-i-e-hilslander.html	18	basic insurance holder want to go to private i.e hilslander	1,727
1111	http://www.englishforum.ch/insurance/139559-not-reimbursed-insoles-health-insurance.html	5	not reimbursed for insoles by health insurance	1,331
1112	http://www.englishforum.ch/insurance/139792-increasing-cost-health-insurance.html	18	Increasing cost of health insurance	1,596
1113	http://www.englishforum.ch/insurance/139553-personal-liability-insurance-am-i-trouble.html	14	Personal liability insurance... Am I in trouble?	1,906
1114	http://www.englishforum.ch/insurance/139940-winterthur-insurance-called-make-claim-they-say-i-don-t-have-right-policy.html	4	Winterthur insurance: called to make claim; they say I don't have right policy	1,062
1115	http://www.englishforum.ch/insurance/9294-unemployment-insurance-question.html	9	Unemployment insurance question	2,473
1116	http://www.englishforum.ch/insurance/139669-help-medical-insurance.html	2	Help!! Medical Insurance	804
1117	http://www.englishforum.ch/insurance/139504-health-insurance-companies-where-you-dont-pay-upfront-costs.html	18	Health insurance companies where you dont pay upfront costs	2,012
1118	http://www.englishforum.ch/insurance/139489-pregnancy-insurance.html	9	Pregnancy and insurance	1,858
1119	http://www.englishforum.ch/insurance/139536-diabetic-basel-insurance-coverage.html	8	A diabetic in basel... :) insurance coverage?	1,288
