	hrefs	replies	threads	views
366	http://www.englishforum.ch/insurance/231301-app-web-manage-insurance-portfolio.html	0	App/web to manage insurance portfolio?	582
367	http://www.englishforum.ch/insurance/231168-green-card-insurance-us-plated-car.html	0	Green card insurance for US plated car	639
368	http://www.englishforum.ch/insurance/147906-accident-insurance-after-unemployment.html	11	Accident insurance after unemployment	2,503
369	http://www.englishforum.ch/insurance/422-velo-vignette-few-questions.html	138	Velo Vignette: A few questions...	29,196
370	http://www.englishforum.ch/insurance/422-velo-vignette-few-questions.html	-	Bike insurance	-
371	http://www.englishforum.ch/insurance/231061-swisscare-student-health-insurance-geneva.html	1	Swisscare student  health insurance Geneva	1,738
372	http://www.englishforum.ch/insurance/231019-do-i-need-health-insurance-my-husband-if-he-gives-up-his-b-permit.html	5	Do I need health insurance for my husband if he gives up his B permit?	786
373	http://www.englishforum.ch/insurance/230978-proof-coverage-insurance-after-permanently-leaving-switzerland.html	6	proof coverage of insurance after permanently leaving Switzerland.	969
374	http://www.englishforum.ch/insurance/229850-signed-up-insurer-too-late-pull-out.html	13	Signed up with an insurer - too late to pull out?	1,710
375	http://www.englishforum.ch/insurance/209976-change-car-insurance.html	32	Change of car insurance	3,054
376	http://www.englishforum.ch/insurance/230424-how-does-health-insurance-thing-work.html	4	How does health insurance thing work?	1,200
377	http://www.englishforum.ch/insurance/230482-health-insurance-payment-back-dated.html	1	Health Insurance Payment Back-dated?	1,253
378	http://www.englishforum.ch/insurance/230411-hospital-stay-insurance-query.html	7	Hospital stay-insurance query	1,109
379	http://www.englishforum.ch/insurance/228734-thieves-tried-break-door-damaged-have-no-insurance-tenant-who-pays-f.html	24	thieves tried to break in, door is damaged, have no insurance as a tenant, who pays f	3,220
380	http://www.englishforum.ch/insurance/230340-operation-needed-germany-type-health-insurance-will-cover.html	4	An operation needed in Germany, which type of health insurance will cover?	1,100
381	http://www.englishforum.ch/insurance/230271-stopping-health-insure-while-vacation-swisscare-student.html	12	Stopping Health Insure while on vacation (SWISSCARE, student)	1,432
382	http://www.englishforum.ch/insurance/230207-dental-insurance.html	6	Dental insurance	1,876
383	http://www.englishforum.ch/insurance/229921-same-insurance-policy-both-cars.html	4	Same insurance policy for both cars?	763
384	http://www.englishforum.ch/insurance/10216-what-does-3rd-party-liability-cover-renters.html	14	What does 3rd party liability cover for renters?	5,191
385	http://www.englishforum.ch/insurance/229675-urgent-question-insurance.html	26	Urgent question insurance	2,047
386	http://www.englishforum.ch/insurance/220883-car-insurance-differ-premiums-swiss-non-swiss-persons.html	69	Car insurance differ in premiums for Swiss and non-Swiss persons	6,459
387	http://www.englishforum.ch/insurance/229649-swica-health-insurance.html	0	SWICA health insurance	1,201
388	http://www.englishforum.ch/insurance/229547-complementary-health-insurance-arthritis.html	6	Complementary Health Insurance for Arthritis	1,016
389	http://www.englishforum.ch/insurance/229454-health-insurance-coverage-international.html	7	Health Insurance Coverage International	1,078
390	http://www.englishforum.ch/insurance/227467-death-disability-insurance.html	10	death and disability insurance	1,757
391	http://www.englishforum.ch/insurance/169054-health-insurance-when-moving-cantons.html	6	Health insurance when moving cantons	2,093
392	http://www.englishforum.ch/insurance/219370-health-insurance-2015-a.html	33	Health insurance for 2015	4,693
393	http://www.englishforum.ch/insurance/229223-airline-travel-supplier-insolvency-insurance.html	5	Airline/Travel Supplier Insolvency Insurance	2,699
394	http://www.englishforum.ch/insurance/229208-life-disability-illness-cover.html	2	Life, Disability & illness cover	1,069
395	http://www.englishforum.ch/insurance/229016-swiss-citizen-who-returned-ch-us-need-insurance.html	8	Swiss citizen who returned to CH from US is in need of insurance.	1,666
396	http://www.englishforum.ch/insurance/155820-mountain-evacuation-via-helicopter-insurance.html	20	Mountain evacuation via helicopter - Insurance	5,102
397	http://www.englishforum.ch/insurance/228610-broken-oven.html	52	Broken oven	3,500
398	http://www.englishforum.ch/insurance/228785-need-idea-dental-insurance-zh.html	2	need idea on dental insurance [ZH]	948
399	http://www.englishforum.ch/insurance/215691-health-insurance.html	12	Health Insurance	1,479
400	http://www.englishforum.ch/insurance/228570-same-insurance-moving-canton-pre-existing-condition.html	2	Same insurance/moving canton/Pre-existing condition	884
401	http://www.englishforum.ch/insurance/228526-health-insurance-l-permit-5-months.html	4	Health insurance with L permit (5 months)	1,041
402	http://www.englishforum.ch/insurance/228458-lamal-phd-student.html	0	LAMal Phd student	678
403	http://www.englishforum.ch/insurance/228446-normal-pay-whole-month-even-i-here-only-1-day.html	5	Is that normal to pay the whole month even I was here only for 1 day?	1,105
404	http://www.englishforum.ch/insurance/225543-page-ranking-mienverbilligung-health-insurance-premium-reduction.html	5	prämienverbilligung [Health Insurance Premium Reduction]	2,642
405	http://www.englishforum.ch/insurance/226824-insurance-do-you-suggest.html	3	Which insurance do you suggest?	1,193
406	http://www.englishforum.ch/insurance/226275-buget-organisation-decrease-fees-health-insurance.html	8	Buget organisation to decrease the fees of health insurance ?	1,294
407	http://www.englishforum.ch/insurance/226353-health-insurance-after-3-months.html	10	Health insurance after 3 months	1,420
408	http://www.englishforum.ch/insurance/228056-regulator-authority.html	2	Regulator Authority	740
409	http://www.englishforum.ch/insurance/227941-pregnancy-gestational-diabetes-new-regulation.html	3	Pregnancy (Gestational) Diabetes  & New Regulation	1,295
410	http://www.englishforum.ch/insurance/227766-rejection-supplementary-insurance.html	15	Rejection of Supplementary Insurance	1,632
411	http://www.englishforum.ch/insurance/227488-cracked-tooth-can-i-claim-accident-insurance.html	21	Cracked tooth: can I claim accident insurance?	2,770
412	http://www.englishforum.ch/insurance/227595-travel-health-insurance-guests-pre-existing-conditions.html	8	Travel health insurance for guests / pre-existing conditions	2,173
413	http://www.englishforum.ch/insurance/227465-car-insurance-without-driving-license.html	2	Car Insurance without driving license?	1,203
414	http://www.englishforum.ch/insurance/226289-insurance-recommendation.html	4	Insurance recommendation	1,203
415	http://www.englishforum.ch/insurance/227339-normal-personal-insurance.html	7	Normal personal insurance?	1,125
416	http://www.englishforum.ch/insurance/206701-private-british-health-insurance-accepted-ch.html	13	Is private British Health insurance accepted in CH.	2,899
417	http://www.englishforum.ch/insurance/227282-dear-moms-how-did-you-pay-your-pregnancy-related-costs.html	2	Dear moms, how did you pay for your pregnancy-related costs?	886
418	http://www.englishforum.ch/insurance/222550-pregnancy-insurance.html	13	Pregnancy and insurance?	2,831
419	http://www.englishforum.ch/insurance/226869-damage-falling-tree.html	4	Damage by falling tree	1,354
420	http://www.englishforum.ch/insurance/226702-short-term-full-casco.html	27	short-term full casco?	1,863
421	http://www.englishforum.ch/insurance/226849-galenos-health-insurance.html	0	Galenos Health Insurance?	758
422	http://www.englishforum.ch/insurance/225875-1-stop-ski-travel-insurance.html	4	1 stop ski/ travel insurance	1,719
423	http://www.englishforum.ch/insurance/220774-basic-health-insurance-medicine-coverage-pregnancy.html	8	Basic health insurance and medicine coverage in pregnancy	2,360
424	http://www.englishforum.ch/insurance/226768-health-insurance-companies-who-work-english-language.html	4	Health Insurance companies who work in English Language	1,057
425	http://www.englishforum.ch/insurance/226483-visana-not-reimbursing-initial-pregnancy-check-up-costs.html	18	Visana not reimbursing initial pregnancy check up costs.	2,113
426	http://www.englishforum.ch/insurance/226551-fire-insurance.html	4	Fire insurance	1,021
427	http://www.englishforum.ch/insurance/226288-ongoing-treatment-new-health-insurance.html	21	Ongoing treatment and new health insurance	1,745
428	http://www.englishforum.ch/insurance/226436-best-travel-insurance-when-you-suffer-allergies.html	5	Best travel insurance when you suffer from allergies	1,085
429	http://www.englishforum.ch/insurance/226088-car-insurance.html	12	car insurance	1,705
430	http://www.englishforum.ch/insurance/208497-please-help-advice-needed-insurance-coverage-pregnancy.html	12	Please help, advice needed on insurance coverage on pregnancy	2,643
431	http://www.englishforum.ch/insurance/226104-other-drivers.html	4	Other Drivers	737
432	http://www.englishforum.ch/insurance/225996-help-please.html	4	help please,	714
433	http://www.englishforum.ch/insurance/74125-health-checkup-during-pregnency.html	12	health checkup during pregnency	2,816
434	http://www.englishforum.ch/insurance/225819-car-insurance-payout.html	11	Car insurance payout	909
435	http://www.englishforum.ch/insurance/225776-rav-taxes.html	1	RAV and taxes	929
436	http://www.englishforum.ch/insurance/225621-taking-sick-leave-right-before-contract-ends-while-rav.html	20	Taking sick leave right before a contract ends or while on RAV	2,482
437	http://www.englishforum.ch/insurance/225440-compulsory-insurance-options-bern.html	7	Compulsory insurance options in Bern	1,652
438	http://www.englishforum.ch/insurance/225217-aargau-what-mess-student-insurance.html	30	Aargau, what a mess with student insurance	2,338
439	http://www.englishforum.ch/insurance/225214-switching-health-insurance-language-childbirth.html	4	Switching health insurance - language and childbirth	810
440	http://www.englishforum.ch/insurance/224623-driving-uk-whilst-visiting-family.html	19	Driving in the UK whilst visiting family.	1,665
441	http://www.englishforum.ch/insurance/223624-2015-insurance-people-changed-cantons.html	6	2015 Insurance for people changed Cantons	1,279
442	http://www.englishforum.ch/insurance/224480-car-insurance-transfer-wife.html	9	Car insurance transfer to wife	1,508
443	http://www.englishforum.ch/insurance/208130-uvg-recommendations.html	1	UVG - recommendations?	1,142
444	http://www.englishforum.ch/insurance/224464-changing-health-insurance.html	4	Changing health insurance	1,012
445	http://www.englishforum.ch/insurance/222715-frontalier-healthcare-should-we-keep-all-our-swiss-insurance.html	7	Frontalier Healthcare - should we keep all our Swiss insurance	1,831
446	http://www.englishforum.ch/insurance/222494-cancel-health-insurance-before-new-premium-notice-received.html	7	cancel health insurance before new premium notice received?	1,727
447	http://www.englishforum.ch/insurance/224332-moving-partner-cancelling-insurance-other-contracts.html	3	Moving in with partner - cancelling insurance and other contracts?	997
448	http://www.englishforum.ch/insurance/224382-cancelling-building-insurance-house-purchase.html	0	Cancelling Building Insurance on House Purchase	913
449	http://www.englishforum.ch/insurance/221865-health-insurance-difference-family-doctor-mode.html	10	health insurance:  the difference of family doctor mode	1,843
450	http://www.englishforum.ch/insurance/220888-best-insurance-model-baby-assura.html	7	Best insurance model for baby: assura	2,557
451	http://www.englishforum.ch/insurance/224360-car-insurance-value-vehicle.html	4	Car Insurance - Value of vehicle	1,091
452	http://www.englishforum.ch/insurance/224305-motorbike-top-box-broken.html	14	Motorbike top box broken.	917
453	http://www.englishforum.ch/insurance/224273-new-switzerland-insurance-permit-help-please.html	4	New to Switzerland - Insurance & permit help please!	2,241
454	http://www.englishforum.ch/insurance/223353-anybody-worked-got-insurance-member-forum-alexm16.html	30	Anybody worked with/got insurance from member on this forum: alexm16	4,101
455	http://www.englishforum.ch/insurance/222826-newbie-question.html	13	Newbie question	1,411
456	http://www.englishforum.ch/insurance/224040-laser-surgery-insurance-claim.html	8	Laser surgery insurance claim	1,473
457	http://www.englishforum.ch/insurance/64638-help-want-cancel-complementary-heath-insurance.html	12	Help - want to cancel complementary heath insurance	3,153
458	http://www.englishforum.ch/insurance/221919-assura-insurance-question-medications.html	13	Assura insurance question on medications	3,206
459	http://www.englishforum.ch/insurance/222823-deductible-2500chf-what-benefit-i-would-get.html	4	deductible 2500CHF, what benefit i would get?	1,157
460	http://www.englishforum.ch/insurance/222984-differences-standard-offers.html	1	Differences on standard offers	754
461	http://www.englishforum.ch/insurance/222821-kolping-canceling-supplementary-insurance-after-changing-provider-basic-one.html	7	Kolping canceling supplementary insurance after changing provider for basic one	1,066
462	http://www.englishforum.ch/insurance/222225-cancel-ten-year-contents-policy.html	11	Cancel TEN year contents policy?	1,567
463	http://www.englishforum.ch/insurance/222829-anyone-heard-bupa-insurance.html	5	Anyone heard of Bupa Insurance?	1,362
464	http://www.englishforum.ch/insurance/35422-anyone-heard-assura-medical-insurance-company.html	66	Anyone heard of Assura medical Insurance company?	26,190
465	http://www.englishforum.ch/insurance/218805-why-hausratversicherung-home-contents-insurance-so-cheap.html	7	Why the Hausratversicherung [home contents insurance] is so cheap	2,351
466	http://www.englishforum.ch/insurance/222732-canton-fr-choosing-english-speaking-doctor.html	0	Canton FR - Choosing an English speaking Doctor	670
467	http://www.englishforum.ch/insurance/222593-if-i-ll-have-kid-when-should-i-start-paying-insurance-her.html	15	If I'll have a kid, when should I start paying the insurance for her?	1,470
468	http://www.englishforum.ch/insurance/222712-i-did-not-change-my-student-insurence-after-finishing-studies-what-will-happen.html	1	I did not change my student insurence after finishing studies. What will happen?	969
469	http://www.englishforum.ch/insurance/221338-blighted-ovum-d-c-cost-if-insurance-cover.html	34	blighted ovum- d&c cost and if insurance cover it	3,380
470	http://www.englishforum.ch/insurance/222362-gym-subscriptions-refundable-health-insurance.html	6	gym subscriptions refundable from health insurance?	1,813
471	http://www.englishforum.ch/insurance/222491-scratched-neighbors-car-but.html	4	Scratched neighbors car, but...	905
472	http://www.englishforum.ch/insurance/222275-restasis-levoxyl-armour-thyroid.html	6	Restasis, Levoxyl & Armour Thyroid	2,008
473	http://www.englishforum.ch/insurance/221932-our-nanny-pregnant-insurance-question.html	42	Our nanny is pregnant (insurance question)	4,896
474	http://www.englishforum.ch/insurance/133104-assure-supra-help.html	7	assure? supra? Help...	2,622
475	http://www.englishforum.ch/insurance/221756-health-insurance-ex-post-facto.html	14	Health insurance ex post facto	1,671
476	http://www.englishforum.ch/insurance/221436-mycss-portal-anyone-else-tried.html	1	myCSS portal - anyone else tried it?	1,036
477	http://www.englishforum.ch/insurance/221944-anyone-know-about-swiss-nova-insurance.html	1	Anyone know about Swiss Nova Insurance?	1,283
478	http://www.englishforum.ch/transportation-driving/5770-drivers-licence-conversion-questions.html	-	Car insurance and drivers license	-
479	http://www.englishforum.ch/insurance/221853-multiple-complementary-medical-insurance.html	1	Multiple complementary medical insurance??	753
480	http://www.englishforum.ch/insurance/221615-physiotherapy-covered-insurance.html	9	Is Physiotherapy covered by Insurance?	1,875
481	http://www.englishforum.ch/insurance/221568-swisscare-health-insurance-get-if-i-am-working-zurich-8-months.html	6	Which swisscare health insurance to get if I am working in Zurich for 8 months	1,441
482	http://www.englishforum.ch/insurance/221674-wanna-change-my-medical-insurance-provider-question.html	6	Wanna change my medical insurance provider... question...	1,131
483	http://www.englishforum.ch/insurance/135182-accident-insurance.html	30	accident insurance	5,889
484	http://www.englishforum.ch/insurance/221604-experience-insurance-brokers.html	2	experience with insurance brokers	794
485	http://www.englishforum.ch/insurance/221520-any-information-cheap-health-insurance.html	2	Any Information on cheap health insurance	1,157
486	http://www.englishforum.ch/insurance/221511-car-insurance.html	4	Car insurance	1,068
487	http://www.englishforum.ch/insurance/180958-complementary-dental-insurance-switzerland-whats-common-way.html	34	Complementary (dental) insurance in Switzerland? Whats the common way?	10,329
488	http://www.englishforum.ch/insurance/221249-been-ch-1-year-no-health-insurance-leaving-country-now-questions.html	5	Been in CH for 1 year, no health insurance - leaving country now - questions	1,086
489	http://www.englishforum.ch/insurance/221240-question-about-dental-treatment.html	2	Question about dental treatment	860
490	http://www.englishforum.ch/insurance/88422-assura-phone-number.html	15	Assura-Phone number??	10,663
491	http://www.englishforum.ch/insurance/220783-who-pays-hospital-bill-healthy-baby-uncomplicated-birth.html	5	who pays? - hospital bill for healthy baby in uncomplicated birth	1,117
492	http://www.englishforum.ch/insurance/220551-doctor-claims-bill-not-paid.html	4	Doctor claims that bill is not paid	1,212
493	http://www.englishforum.ch/insurance/220405-health-insurance-best-option.html	2	Health Insurance - best option	1,273
494	http://www.englishforum.ch/insurance/220271-unemployment-language-courses.html	37	Unemployment. Language Courses	2,944
495	http://www.englishforum.ch/insurance/218769-legal-insurance-insurance-insurance.html	5	legal insurance / insurance for insurance?	1,727
496	http://www.englishforum.ch/insurance/219984-dental-insurance-anyone-know-what-zahn-no-foojer-75-means.html	3	"Dental insurance - anyone know what ""zahn no foojer #75""means?"	1,015
497	http://www.englishforum.ch/insurance/219885-using-form-health-insurance-exemption.html	4	Using Form A for Health Insurance exemption	1,362
498	http://www.englishforum.ch/insurance/219886-bike-insurance.html	3	Bike Insurance?	941
499	http://www.englishforum.ch/insurance/219786-any-reduction-chomage-rav-people-buy-mandatory-health-insurance.html	3	Any reduction for Chomage/RAV people to buy mandatory health insurance	1,357
500	http://www.englishforum.ch/insurance/219676-declined-claim-insurance-company.html	13	Declined claim from Insurance company	1,460
501	http://www.englishforum.ch/insurance/219598-household-insurance-compensation-limit-automatic-adjusted.html	3	Household insurance: compensation limit automatic adjusted?	927
502	http://www.englishforum.ch/insurance/219403-insurance-term-duration-multiple-years.html	5	insurance term / duration for multiple years	728
503	http://www.englishforum.ch/insurance/219342-gest-union-broker.html	0	Is Gest Union Broker?	1,054
504	http://www.englishforum.ch/insurance/219121-looking-best-economical-insurance-company-neuchatel.html	3	Looking for best economical insurance company in Neuchatel	937
505	http://www.englishforum.ch/insurance/219073-how-long-pension-payout.html	3	How long for Pension Payout	853
506	http://www.englishforum.ch/insurance/218284-why-does-medicine-cost-so-much.html	4	Why does medicine cost so much ?	1,352
507	http://www.englishforum.ch/insurance/218851-outstanding-health-insurance-bills.html	8	"""Outstanding"" health insurance bills"	1,174
508	http://www.englishforum.ch/insurance/203809-proposed-new-health-insurance-system.html	95	[proposed] new health insurance system	8,230
509	http://www.englishforum.ch/insurance/218708-health-insurance-bring-boyfriend.html	5	Health insurance and bring boyfriend	1,158
510	http://www.englishforum.ch/insurance/218696-transfering-car-insurance-bonus.html	1	Transfering car insurance bonus	868
511	http://www.englishforum.ch/insurance/218428-thread-split-nhs-vs-swiss-health-insurance.html	126	[Thread Split] NHS vs Swiss Health Insurance	5,812
512	http://www.englishforum.ch/insurance/189334-specifically-about-css-student-care.html	9	Specifically about CSS Student Care	4,749
513	http://www.englishforum.ch/insurance/218394-health-insurance-pregnancy.html	4	Health Insurance - pregnancy	1,410
514	http://www.englishforum.ch/insurance/218445-car-taxes-plates-insurance-road-tax-lausanne.html	1	Car taxes (plates, insurance, road tax in Lausanne)	1,227
515	http://www.englishforum.ch/insurance/218325-insurance-claim-denied-what-next.html	14	insurance claim denied what next !!	2,815
516	http://www.englishforum.ch/insurance/218320-company-accident-insurance-correspondence-english-help-please.html	4	Company accident insurance with correspondence in ENGLISH - help (please)!	1,080
517	http://www.englishforum.ch/insurance/218293-css-okk-others.html	0	css / okk / others?	1,042
518	http://www.englishforum.ch/insurance/218194-daily-sickness-benefits-insurance-unemployed.html	0	Daily Sickness Benefits Insurance - for unemployed	1,001
519	http://www.englishforum.ch/insurance/217147-changing-health-insurance-reminder.html	4	Changing health insurance (reminder)	1,260
520	http://www.englishforum.ch/insurance/217760-double-claims-right.html	8	Double claims - Is this right?	981
521	http://www.englishforum.ch/insurance/217553-gp-model-gp-never-works.html	21	GP Model - GP never works.	1,883
522	http://www.englishforum.ch/insurance/216426-ahv-insurance-students.html	3	AHV Insurance for Students	1,408
523	http://www.englishforum.ch/insurance/217008-choosing-insurance-what-does-healthcare-cost.html	21	Choosing Insurance: What does healthcare cost?	3,732
524	http://www.englishforum.ch/insurance/761-indians-claiming-ahv.html	12	Indians Claiming AHV	9,436
525	http://www.englishforum.ch/insurance/216942-insurance-claim-when-other-car-bumps-your-car.html	13	Insurance claim when other car bumps your car	1,519
526	http://www.englishforum.ch/insurance/216999-assigned-health-insurance.html	5	Assigned Health Insurance	909
527	http://www.englishforum.ch/insurance/216916-health-insurance-benefits-clearly-defined.html	1	Health insurance benefits clearly defined	798
528	http://www.englishforum.ch/insurance/216824-idirect24-car-insurance.html	4	iDirect24 for car insurance	1,121
529	http://www.englishforum.ch/insurance/216757-difference-between-accident-personal-liability-insurance.html	15	Difference between accident and personal liability insurance	1,829
530	http://www.englishforum.ch/insurance/216793-car-insurance-possible-not-make-claim.html	13	car insurance - possible to NOT make a claim?	1,559
531	http://www.englishforum.ch/insurance/145217-offer-swica-do-you-think-s-attractive.html	5	Offer from Swica, do you think it's attractive?	2,633
532	http://www.englishforum.ch/insurance/216622-effect-claiming-house-insurance.html	3	Effect of claiming on house insurance	842
533	http://www.englishforum.ch/insurance/216193-health-insurance-baby-extra-needs.html	16	Health insurance for a baby with extra needs	1,925
534	http://www.englishforum.ch/insurance/216500-life-insurance.html	0	Life insurance	842
535	http://www.englishforum.ch/insurance/216237-motor-insurance-directive.html	14	Motor Insurance Directive	1,113
536	http://www.englishforum.ch/insurance/216150-taxi-costs-covered-insurance.html	6	Taxi costs covered by insurance?	1,189
537	http://www.englishforum.ch/insurance/214880-hit-wall-trying-get-health-insurance.html	82	Hit a wall trying to get health insurance.	5,321
538	http://www.englishforum.ch/insurance/216091-health-insurance.html	3	Health Insurance	679
539	http://www.englishforum.ch/insurance/215798-avoiding-astronomical-car-hire-additional-insurance-charges.html	8	Avoiding astronomical car hire additional insurance charges	1,857
540	http://www.englishforum.ch/insurance/215396-health-insurance-after-3-months.html	7	Health insurance after 3 months	1,878
541	http://www.englishforum.ch/insurance/215536-insurance-eu-citizens.html	6	insurance for EU citizens	1,317
542	http://www.englishforum.ch/insurance/215378-travel-insurance-buy-especially-need-flight-luggage-delay.html	2	which Travel insurance to buy? especially need for flight&luggage delay	975
543	http://www.englishforum.ch/insurance/214928-mobicasa-bike-theft-home-interim-rental-costs-refundable.html	4	MobiCasa - Bike Theft from home, are interim rental costs refundable?	1,396
544	http://www.englishforum.ch/insurance/214980-insurance-my-girlfriend.html	5	Insurance for my girlfriend	1,084
545	http://www.englishforum.ch/insurance/35552-krankenkasse-health-insurance-gym-membership.html	8	Krankenkasse Health Insurance - Gym Membership?	4,724
546	http://www.englishforum.ch/insurance/125219-axa-winterthur-contents-insurance.html	2	Axa Winterthur Contents Insurance	2,419
547	http://www.englishforum.ch/insurance/214840-injured-passenger-car-can-i-claim.html	36	Injured Passenger in Car - Can I Claim	2,119
548	http://www.englishforum.ch/insurance/200575-supplementary-insurance-how-does-work.html	9	Supplementary Insurance - How does it work?	2,311
549	http://www.englishforum.ch/insurance/214649-brand-new-car-insurance.html	2	Brand new car insurance	907
550	http://www.englishforum.ch/insurance/211755-pregnancy-international-insurance.html	43	Pregnancy on international insurance	3,313
551	http://www.englishforum.ch/insurance/214332-damaged-car-insurance-question.html	4	Damaged car - insurance question	1,116
